"Owls Fall in Hard-Fought Battle to Florida","BOCA RATON, Fla. – The Florida Atlantic women's basketball team battled closely with Florida but were unable to hold on through the end of the game, dropping the contest 59-51 inside Eleanor R. Baldwin Arena. The Owls fall to 2-3 while Florida improves to 6-1 on the season. HOW IT HAPPENED The Owls had a slow start to the first quarter, with their first points coming from Destyne Jackson three minutes in. This was followed up by a Vivian Onugha layup to make the score 6-4 with 4:12 to go. Florida went on a 6-0 run before a Jess Moors jumper closed out the quarter, with FAU trailing by six, 14-8. The Gators started to pull away at the start of the second, putting the Owls down by 10. Jackson brought FAU back within five points and started a 9-0 run for the Owls, allowing them to bring the score to 18-17. Florida Atlantic got its first lead of the game from a Michiyah Simmons 3-pointer with three minutes to go in the quarter, 20-19. The Owls led by two, 24-22, with under a minute to play, but the Gators closed the half on a 3-0 run to take a one-point advantage into the halftime break, 25-24. Jackson knocked down a jumper to put the Owls back in front to open the third, 26-25, getting her ninth point of the night. The lead continued going back and forth, with six consecutive lead changes. Florida maintained the lead from the 6:28 mark through the end of the third. The Owls kept it close, ending the third down just five, 44-39. The Gators extended their lead to the largest of the night at 11 at the beginning of the fourth quarter, holding Florida Atlantic scoreless until the 7:15 mark. The Gators pushed their lead back to 11 with 33 seconds to play, but a late rally just wasn't enough to close the gap, as Florida took the 59-51 contest. HEAR FROM HEAD COACH LEANN FREELAND ""Really excited about the effort tonight against Florida. They are a very good team, and I thought we fought extremely hard for 40 minutes. There are a lot of things that we continue to improve, and I thought we improved a lot of those things today. We are about growth right now, so every game and every practice is instrumental for us to continue to make those moves."" NOTES AND TEAM STATS Jackson led the team in scoring with 10 points on the night. Onugha and Simmons were close behind with nine apiece. Onugha narrowly missed her second double-double of the season, leading the team on the glass with nine boards. The Owls outshot the Gators from the line, 76.9 percent to 73.1 percent. Florida Atlantic won the possession game, outpacing the Gators in steals, collecting 13 to Florida's six. Moors led the Owls in this category, collecting a game-high five steals. The Owls also bested the Gators on the offensive glass, 15 to 14, and forced Florida into more turnovers, 21 to 19. UP NEXT The Owls kick off the Thanksgiving Classic inside Eleanor R. Baldwin Arena on Thursday, Nov. 27, at 12 p.m., where they will face off against Air Force on ESPN+. FOLLOW THE OWLS To stay up to date with everything Florida Atlantic women's basketball, follow @FAUWBB_Hoops on X and @FAUWBB on Instagram, or like Florida Atlantic Women's Basketball on Facebook. Florida Atlantic's 2025-26 season is sponsored by Flagler Credit Union.","https://fausports.com/news/2025/11/24/womens-basketball-owls-fall-in-hard-fought-battle-to-florida"
"Meet Wendol Philord","Philord is wrapping up his sixth and final year of collegiate eligibility, two seasons after transferring from an NAIA school at Keiser to Division I. The Miami native began his football journey when he was just three years old. One thing that sticks with him to this day is the bonds and relationships he quickly created with his teammates. These relationships were a family, without being blood related as described by Philord. ""My team and I, we played together all the way growing up from middle school to high school. Of course we had some people that left, but the main people, we stayed together."" said Philord. Philord began his freshman season amidst the Coronavirus pandemic, resulting in his first collegiate campaign being postponed from fall 2020 to the spring of 2021. Although Philord had to adjust to this change, he acknowledges that the experience helped him improve his game. ""After a season, you must wait a whole year to do it again. But this year, I had a season, then I had a short two-month break, and then it was back into another season."" Philord believed the shortened break helped keep him in shape and focused on the upcoming season. Throughout his time at Keiser, Philord went on to lead his team in multiple categories. In his freshman year, Philord matched a program single season record with six interceptions on his way to earning the MSC Sun Division First Team Honors. In his sophomore year, as Philord found his way as the designated return man. He led the NAIA in total return yards (785) while leading the Seahawks in interceptions with four. He was named a first-team All-Sun Conference selection as a defensive back for the second straight year. That same season, Philord and his Keiser team advanced to the semifinals of the NAIA Football Championship Series, where they lost to Northwestern College. He recalls the moment as leaving a sour taste in his mouth. The loss stuck with Philord and his teammates, which pushed them to work harder and had them focus on one task for the next season: winning a National Championship. In Philord's junior year, he continued to perform at an exceptional level. He returned 17 kicks for a total of 424 yards and one score and returned 24 punts, three for a score. Defensively he had three forced fumbles and three interceptions on the year. It was that junior year after three seasons of dedication and hard work that Philord was able to capture that elusive National Championship he had desired. Besides the birth of his son, Philord described this as the happiest moment in his life. ""Being able to win the first national championship for the Keiser football program, being a part of that team, everything was just unbelievable."" In 2024, Philord made the transfer to Florida Atlantic, which was set to be his final year of eligibility. That season, he recorded 40 total tackles, four deflected passes and two forced fumbles and took on responsibility as a leader. In late 2024, the NCAA approved a blanket waiver, which granted an additional year of eligibility to for JUCO (Junior College) transfers. At the time, Philord was preparing for the NFL Pro Day when he learned the news. He spoke with his agent who encouraged him to take advantage of the opportunity in front of him. Philord's leadership role continued in his second year with the Owls, being named a team captain. In eight games, he ties the team high with five pass breakups and has totaled 15 tackles, one for a loss.","https://fausports.com/news/2025/11/24/football-meet-wendol-philord"
"Veltkamp Earns American Conference Honorable Mention","BOCA RATON, Fla. – Florida Atlantic redshirt junior quarterback Caden Veltkamp has received American Conference Player of the Week Honorable Mention honors, as announced by the league on Monday. Last Saturday, Veltkamp continued his assault on the Owls' record book. The QB finished the UConn contest with the program's single-game record in most attempts, completions and passing yards going 42-55-1 for 494 yards on the night. He tossed two TDs, including one for 90 yards, which is the third longest in program history. Veltkamp also added 23 yards on the ground on four carries and two scores, including an 11-yard rush that put the Owls up 45-41 with 2:11 remaining in the game. He led FAU's offense through 87 plays totaling 687 yards. Veltkamp distributed to six receivers, three of which tallied more than 100 yards, becoming the first trio in program history that three receivers surpassed the 100-yard plateau. CELEBRATING 25 YEARS Click HERE for 25 Years Celebration Content. COMPLETE 2025 SCHEDULE Click HERE. GROUPS OF ALL AGES To purchase group tickets, click HERE. CELEBRATING 25 YEARS Click HERE for 25 Years Celebration Content. GROUPS OF ALL AGES To purchase group tickets, click HERE. FOLLOW THE TEAM Stay informed by reading FAUSports.com or through football's Twitter and Instagram accounts @FAUFootball.","https://fausports.com/news/2025/11/24/football-veltkamp-earns-player-of-the-week-honors"
"Hometown Team with Zion Sampaio","BOCA RATON, Fla. -- In an effort to make the Owls the hometown team for Boca Raton, student-athletes have totaled nearly 20,000 hours of community service during Vice President and Director of Athletics Brian White's tenure. In part of this effort, we will showcase our hometown student-athletes from the Florida Keys through West Palm Beach. Meet Florida Atlantic's men's basketball freshman, Zion Sampaio, as one of our Hometown student-athletes of the ""Hometown Team"" series. MEET ZION SAMPAIO Hometown Team is presented by Wyndham Deerfield Beach Resort. FOLLOW THE OWLS To stay up to date on all things FAU men's basketball, follow the Owls on social media @FAUMBB.","https://fausports.com/news/2025/11/23/mens-basketball-hometown-team-with-zion-sampaio"
"Owls Host Florida Monday","BOCA RATON, Fla. – Florida Atlantic women's basketball returns to Paradise Monday, Nov. 24, as they get set to host SEC foe Florida for a 7 p.m. tip-off inside Eleanor R. Baldwin Arena on ESPN+. MATCHUP INFO Florida Atlantic (2-2) vs. Florida (5-1) Date: Monday, Nov. 24 Time: 7 p.m. ET Location: Eleanor R. Baldwin Arena in Boca Raton, Fla. GAME COVERAGE TV: ESPN+ Live Stats: StatBroadcast A LOOK AT THE OWLS Florida Atlantic enters Monday's contest at 2-2 on the season, coming off a hard-fought 70-63 defeat on the road at South Alabama. As a team, the Owls lead the American and rank 32nd nationally in 3-point percentage (.380), FAU also ranks second in the conference in 3-pointers per game (7.5), third in bench points per game (30.0), field goal percentage (.435), fewest fouls per game (19.0), and free throw attempts per game (23.5), fourth in free throws made per game (16.0), and fifth in scoring defense (65.8), steals per game (10.), and winning percentage (.500). The Owls' offensive leaders are Grace Carstensen and Vivian Onugha. Carstensen and Onugha are tied for a team-leading 12.2 points per game through four contests this season. Onugha leads the Owls on the glass, collecting a team-best 6.0 rebounds per contest. Haley Walker has also been a big presence on the boards for the Owls, ranking second on the team with 5.8 rebounds per game. The Owls' assist leader is Michiyah Simmons, who leads the team with nine total assists this season, while Ineivi Plata leads in assists per game, dishing out 2.7 assists per contest. Destyne Jackson and Jess Moors pace the Owls in steals, collecting a team-leading 2.2 steals per contest apiece. SCOUTING FLORIDA Florida enters Monday's contest at 5-1 on the season, falling on the road at Navy, 69-54, but most recently earning an 89-67 win at home over Florida State. The Gators are led offensively by Liv McGill, Me'arah O'neal, and Laila Reynolds. McGill boasts a team-best 26.0 points per game, while O'neal and Reynolds follow behind at 16.3 and 15.5 points per game, respectively. McGill also leads Florida in assists and steals, tallying 6.8 assists and 4.8 steals per game this season. O'neal paces the Gators in the boards, recording 9.0 rebounds per game, in addition to leading the team in blocks, denying 1.5 per contest. SERIES HISTORY Monday's matchup marks the 10thall-time meeting between Florida Atlantic and Florida. The Gators hold the all-time series lead at 8-1. In Boca Raton, the Gators hold the slight 2-1 series advantage. The Owls will look to snap a five-game skid against the Gators, which includes an 82-54 defeat during last season's season opener on Nov. 4, 2024, in Gainesville. FAU earned its sole win over the Gators on February 16, 1993, in Boca Raton. LAST TIME OUT: AT SOUTH ALABAMA The Owls fell in a hard-fought 70-63 road battle at South Alabama this past Thursday. Four Owls scored in double-figures, led by Onugha with a game-best 17 points, shooting 55 percent (6-of-11) from the field and 83 percent (5-of-6) from the line. Moors and Destyne Jackson tied with 11 points apiece, and Michiyah Simmons rounded out the Owls' double-figure scorers with 10 points on the night. Jackson dished out a game-high three assists to lead the team. Moors led the Owls in steals, collecting a season-high six. Haley Walker led the Owls on the glass, collecting six rebounds. Madi Gewirtz recorded the Owls' sole block in the contest. The Owls outscored the Jaguars in the first quarter, 16-15, and in the fourth quarter, 20-15. Florida Atlantic also outshot South Alabama from 3-point range, 33.3 percent to 29.4 percent, and at the line, 82.8 percent to 72.4 percent, while also holding an advantage in fast break points, outscoring USA 18-11 in transition. UP NEXT Following Monday's contest, the Owls will host their Thanksgiving Classic Nov. 27-29, welcoming Air Force and Wright State. FAU will open the tournament on Thursday, Nov. 27, at 12 p.m. against Air Force. FOLLOW THE OWLS To stay up to date with everything Florida Atlantic women's basketball, follow @FAUWBB_Hoops on X and @FAUWBB on Instagram, or like Florida Atlantic Women's Basketball on Facebook. Florida Atlantic's 2025-26 season is sponsored by Flagler Credit Union.","https://fausports.com/news/2025/11/23/womens-basketball-owls-host-florida-monday"
"Owls in Daytona Beach for Sunshine Slam","DAYTONA BEACH, Fla. – The Florida Atlantic men's basketball team is set for the two-day Sunshine Slam in Daytona Beach, with the Owls taking on Loyola Marymount for the first game on Monday, Nov. 24, at 8:30 p.m. and then either George Mason or Ohio on Tuesday, Nov. 25. Both games will air on CBS Sports Network. As part of the four-team Beach Bracket, the winner of FAU (4-1) and the Lions (6-0) will face the victor of the Patriots (5-0) versus Bobcats (1-4) matchup for Tuesday's tournament championship at 7:30 p.m., with the remaining teams participating in a third-place game at 5 p.m. All games will be played at the Ocean Center. This will mark the Owls' third November tournament in three seasons, winning the ESPN Events Invitational in 2023 at Walt Disney World and recording a victory over Oklahoma State in 2024 at the Shriners Children's Charleston Classic. LAST TIME OUT Florida Atlantic hosted Pacific, a member of the Sunshine Slam's Ocean Bracket, a part of a home game for the Sunshine Slam on Thursday, Nov. 20. The Owls put forth their best shooting performance of the season, going 55.8% from the field. Junior guard Kanaan Carlyle led the way with an FAU-best 21 points. ABOUT THE OWLS John Jakus is in his second season at the helm of the program. In his debut campaign in 2024-25, he was a finalist for the Joe B. Hall Award, given to the nation's top first-year head coach. Under Jakus' watch, the Owls participated in their fourth straight year of postseason play, selected to the 2025 National Invitational Tournament. FAU boasts eight international players. In total, the Owls are represented by seven different countries: the United States, Canada, Germany, Italy, Belgium, Senegal, and France. Returning for the Owls are redshirt junior guard Niccolo Moretti, redshirt sophomore guard Devin Vanterpool, and redshirt freshman guards Amar Amkou, Liam Dayco-Green, and Max Langenfeld. Vanterpool has had a career-best start to the season, leading the team in points per game (16.2), rebounds per game (6.4), assists per game (3.2), and steals (1.8). Against Coastal Georgia, he scored 30 points to be the first Owl to do so since Johnell Davis in January of 2024. The Owls welcome 10 newcomers: four true freshmen, four from the transfer portal, and two international players. Guard Josiah Parker was named the American Conference's Preseason Freshman of the Year. Florida Atlantic was ranked sixth in the American preseason coaches poll. FAU has tallied 18 blocks in the last two games. They average 6.6 per game, tied for 12th in the nation. ABOUT THE LIONS Stan Johnson has coached the Lions for six seasons and is seeking his second straight winning campaign. LMU is off to a 6-0 start for just the third time in program history. They were the first team in the nation to reach six wins to start the 2025-26 season. Redshirt senior guard Myron Amey Jr. is the team's leading scorer at 17.5 points per game. As a team, the Lions are 20th in the nation in field goal percentage (.526). This marks the first meeting between the Owls and Lions in program history. UP NEXT Florida Atlantic will host St. Bonaventure at Eleanor R. Baldwin Arena on Sunday, Nov. 30. Tipoff is at 3:30 p.m. on ESPN2. SCHEDULE Click here for the 2025-26 schedule. ROSTER Click here for the full 2025-26 men's basketball roster. FOLLOW THE OWLS To stay up to date on all things FAU men's basketball, follow the Owls on social media @FAUMBB. Florida Atlantic's 2025-26 season is sponsored by Phil Smith Kia/Phil Smith Acura.","https://fausports.com/news/2025/11/23/mens-basketball-owls-in-daytona-beach-for-sunshine-slam"
"Owls Complete Patriot Invitational; Women Victorious","BOCA RATON, Fla. – The Florida Atlantic men's and women's swimming and diving teams completed the Patriot midseason Invitational Saturday evening with the women walking away victorious in the standings for the third consecutive season. Once again, senior Daniel Laureyssens set a program record, this time in the men's 100 free. This is Laureyssens' third time breaking the 100 free program record this season. Overall on the weekend, the Owls walked away with eight new program records, Laureyssens with five himself (50 free (twice), 100 free, 200 free, and as a member of 200 free relay). FAU also saw four new freshman program records earned. Team Scores Post Day Three (WOMEN): Florida Atlantic: 2,010 Towson: 1,630 Richmond: 1,182 Marist: 933 George Mason: 913 American: 899 Monmouth: 423 UNC-Wilmington: 110 (MEN): Towson: 2,118.5 Florida Atlantic: 1,910.5 George Mason: 1,371 Marist: 952.5 Monmouth: 781.5 American: 486.5 Marymount: 252.5 UNC-Wilmington: 156 QUICK HITS Men For the third time this season, Laureyssens broke the 100 free program record, this time lowering the time to 42.77. James Shevchenko tallied another event win this time in the 200 fly, swimming 1:45.70. He also finished third in the 200 back (1:46.21). The Owls wrapped up the fourth and final day with a second-place finish in the 400 free relay (2:57.40). Women FAU began the day with a 2-3 finish in the 1650 free with Alex Stevens (16:54.49) and freshman Viktoria Sorensen (17:02.12). Megan Drover-Smith won the 200 back (1:57.30). The Owls went 1-2-3 in the 100 free with Maja Piotrowicz (49.93) taking the win. Izzy Jones (50.45) and Bry Bellile (50.59) followed closely behind in second and third place, respectively. Nula Gow led the Owls to another 1-2-3 finish, winning the 200 breast, swimming 2:12.85. Bilú Bianchi (2:13.64) and Ella Freeman (2:15.37) earned second and third, respectively. The Patriot Invite concluded with the Owls victorious in the 400 free relay (3:21.58). ON DECK Select Owl swimmers will participate in the Toyota U.S. Open, December 3-6, in Austin, Texas, and the CSCAA Open Water National Championship on December 13, in Nathan Benderson Park, located in Sarasota, Florida. The next official meet for Florida Atlantic will be on December 15 in Coral Cables, Florida, as the Owls face the University of Miami women's team and Cincinnati. SCHEDULE For the full 2025-26 swim & dive schedule, click HERE. ROSTER For the full 2025-26 swim & dive roster, click HERE. FOLLOW THE OWLS For complete coverage from the meet and more FAU swimming & diving news, follow along on social media platforms (@fauswimdive).","https://fausports.com/news/2025/11/22/swimming-diving-owls-complete-patriot-invitational-women-victorious"