"College of Nursing Receives $1.8M Gift from Mark Bruce Swillinger","Mark Bruce Swillinger has donated a $1.5 million gift to Florida Atlantic University's Christine E. Lynn College of Nursing in memory of his late wife, Marilyn Lee Swillinger, to establish an endowed professorship in hospice and palliative care nursing.

Florida Atlantic University's Christine E. Lynn College of Nursing has received a $1.5 million gift from Mark Bruce Swillinger in memory of his wife, Marilyn Lee Swillinger, to establish an endowed professorship in hospice and palliative care nursing. The Mark Bruce and Marilyn Lee Swillinger Endowed Professor will expose nursing students to specialized studies in hospice and palliative care throughout their nursing education. Additional gifts totaling $300,000 name the dean’s conference room for Marilyn Lee Swillinger, and the collaborative classroom for Mark and Marilyn together.

Marilyn Lee Swillinger, who passed away on Oct. 30, 2023, after a two-year battle with lung cancer, was especially passionate about supporting health care and the arts. She was a longtime member of the College of Nursing’s advisory board and supported other FAU colleges and departments, in addition to numerous other local charitable organizations.

“This is my opportunity to memorialize Marilyn and give back to the community, which has given so much to us,” said Mark Swillinger. “I can’t say enough about the treatment that hospice gave to Marilyn and me. It’s important not only to the people in need but also for everyone within our community.”

The Mark Bruce and Marilyn Lee Swillinger Endowed Professorship in Hospice and Palliative Care Nursing will provide support in perpetuity for a professor with expertise in hospice and palliative care who will direct the integration of this nursing specialty into the undergraduate curriculum that includes academics, simulation, clinical training, and preparation for certification in all levels in hospice and palliative care. This professor will also introduce students to this important specialty early in their academic careers and promote and prepare them for rewarding careers in hospice and palliative care.

“Our region faces critical shortages in nursing and health care, and this generous gift will have a lasting impact on the university and the communities we serve,” said FAU President Adam Hasner. “Through their involvement and support over the years, Mark and Marilyn truly embraced Florida Atlantic as their hometown university. We are grateful that Mark chose to establish this meaningful legacy in memory of Marilyn in our College of Nursing.”

The need for hospice and palliative care is especially acute in Florida as more than 21% of state residents are age 65 or older, according to the U.S. Census Bureau, a number expected to grow to 27% by 2030. And the overall need for nurses continues to be crucial. FAU’s College of Nursing will be the first in the region to offer such a program focused on hospice and palliative care.

“As a member of the College of Nursing’s first advisory board, Marilyn had a profound influence on the college, helping it grow to what it is today,” said Cameron Duncan, Ph.D., DNP, Holli Rockwell Trubinsky Eminent Dean of Nursing. “Hospice and palliative care are so important to the community, and so many lives are going to be impacted because of Mark’s generosity.”

If you are experiencing difficulty accessing information on the Florida Atlantic University website due to a disability, visit the website accessibility page.","https://www.fau.edu/newsdesk/articles/college-of-nursing-receives-gift-from-mark-bruce-swillinger.php"
"Record Number of Merit Scholars Attending FAU","Florida Atlantic University is welcoming 40 National Merit Scholars this semester, with 19 of them returning and 21 of them attending FAU for the first time.

Florida Atlantic University is welcoming 40 National Merit Scholars this semester, with 19 of them returning and 21 of them attending FAU for the first time. The entire National Merit Scholars group total sets a record for the university, while the new member total is the second-highest ever in FAU’s history.

“We are elated to welcome our incoming, exceptionally talented National Merit Scholars as they join their peers at Florida Atlantic University,” said Mary Ann Gosser Esquilín, Ph.D., assistant dean of the FAU Honors and Scholars Program. “We look forward to shining a spotlight on their successes as they pursue research opportunities and continue to excel in their chosen academic fields.”

The record-setting class also has local ties. Of the 40 National Merit Scholars, 25 hail from the state of Florida; with five FAU High School alumni part of the new group of 21.

The National Merit Scholarship Program is an annual academic competition among high school students for recognition and college undergraduate scholarships that began in 1955. The program is conducted by National Merit Scholarship Corporation, a not-for-profit organization that operates without government assistance.

United States high school students enter the National Merit Scholarship Program by taking the Preliminary SAT/National Merit Scholarship Qualifying Test, which serves as an initial screen of more than 1.3 million entrants each year, and by meeting published program entry and participation requirements.

If you are experiencing difficulty accessing information on the Florida Atlantic University website due to a disability, visit the website accessibility page.","https://www.fau.edu/newsdesk/articles/record-number-of-merit-scholars-attending-fau.php"
"FAU Ranks in 'Washington Monthly' Top 40","Washington Monthly ranked Florida Atlantic University at No. 39 on the “America’s Best Colleges for Your Tuition (and Tax) Dollars” list among the nation’s best public and private universities, in the publication’s annual College Guide. FAU also was ranked No. 5 in the “Best Bang for the Buck” for Southeast colleges and on the “Top 25 Best-in-Class Colleges” list.

If you are experiencing difficulty accessing information on the Florida Atlantic University website due to a disability, visit the website accessibility page.","https://www.fau.edu/newsdesk/articles/fau-rankings-washington-monthly-2025.php"
"Theatre Lab Begins Second Decade of Programming New Work","Promotional photo by Manny Zaldivar. Actors pictured (center, then clockwise from bottom left): Pryscila Cassiano Salinas, Randall Swinton, Heather Simsay, Dayana Morales, Casey Sacco and Brendan Feingold.

The season opens with a Heckscher Theatre for Families production – the world premiere of “Heebie Jeebies: Tales from the Midnight Campfire” by local playwright and educator Gina Montét. Commissioned specifically for Theatre Lab, the play reimagines spooky stories from classic literature for modern audiences. Tickets are $25 for adults, and each adult ticket includes up to two free student tickets. Additional student tickets are $5 each. Tickets and season subscriptions are available at 
                           fauevents.com
                         or by calling 561-297-6124.

“These family productions are meant to entertain and engage the imaginations of audience members of all ages, and they’re some of my favorites of our past productions,” said Matt Stabile, producing artistic director at Theatre Lab. “Heebie Jeebies is a hilarious evening of thrills and mild chills — the perfect family outing for fans of “Goosebumps” and “The Twilight Zone.” It will also inspire thousands of students across South Florida to create and share original stories of their own.”

Pre-show events will be held one hour before the performances. Activities include free creative writing workshops for students in grades 4–12 on Saturdays at 2 p.m.; “S’mores Saturdays” with free s’mores on the patio at 6 p.m.; and “Crafty Sundays” at 2 p.m. with arts and crafts on the patio.

The production also serves as the centerpiece of The Future PAGES Project, which offers free in-school creative writing workshops and field trips for students in grades 4–12 across Palm Beach and Broward counties. Since its launch in 2015, the program has served more than 12,000 students at no cost.

“Our program starts with a visit to partner schools, where we provide a writing workshop to help students identify and utilize the parts of a story,” said Jill Carr, Theatre Lab’s director of education and community outreach. “This year’s theme is ‘Nothing to Fear,’ and we’re excited to read the dynamic and surprising stories the show and program will inspire.”

Heckscher Theatre for Families Production

Heebie Jeebies: Tales from the Midnight Campfire
                        By Gina MontétWorld premiere and Heckscher Theatre for Families commissionDirected by Matt Stabile

Charlie hates summer camp. After plotting her escape and sneaking out of her cabin one night, she stumbles upon a group of campers deep in the woods. They promise to help her get home, but only if she agrees to spend the night listening to their spooky campfire stories. Will Charlie survive the night — and their haunting tales?

Local playwright and educator Gina Montét returns to Theatre Lab with her newest show, commissioned specifically for the annual Heckscher Theatre for Families production. Inspired by classic spooky stories updated for modern times, “Heebie Jeebies” is billed as “a hilarious evening of thrills and mild chills” and is recommended for fans of “Goosebumps” and “The Twilight Zone.”

Dates: Sept. 20–Oct. 12

Performances: Saturdays at 3 and 7 p.m.; Sundays at 3 p.m.
                        Field trip performances: Wednesdays through Fridays at 10:30 a.m. (for partner schools and organizations)

All performances take place at the Heckscher Stage in Parliament Hall, 777 Glades Road, Boca Raton campus.

For more information about Theatre Lab, visit 
                           fau.edu/theatrelab
                        .

If you are experiencing difficulty accessing information on the Florida Atlantic University website due to a disability, visit the website accessibility page.","https://www.fau.edu/newsdesk/articles/theatre-lab-new-season-2025-2026.php"
"FAU Kicks Off Construction of Wallach Building","From left, FAU President Adam Hasner; FAU benefactor Marilyn Wallach; Mark Wallach; and Michael Horswell, Ph.D., dean of the Dorothy F. Schmidt College of Arts and Letters at FAU, celebrate the start of construction of the Kurt and Marilyn Wallach Holocaust and Jewish Studies Building.

Florida Atlantic University celebrated the start of construction of its Kurt and Marilyn Wallach Holocaust and Jewish Studies Building. The 22,000-square-foot, two-story structure will be the home of Florida Atlantic’s Holocaust education, Jewish studies and related programs. It also will become a South Florida destination for visitors seeking first-hand knowledge about the Holocaust, including cultural performances, lectures and exhibits that further understanding and respect for humanity. Construction is expected to take approximately 14 months with a targeted opening of fall 2026.

“This is a monumental day, and I know Kurt would be so proud to see this building become a reality,” said Marilyn Wallach. Kurt Wallach died in 2021, a year after the couple made a transformational $20 million gift to FAU to create the Kurt and Marilyn Wallach Institute for Holocaust and Jewish Studies, with a portion used as the lead gift to construct the Wallach building.

“Kurt always said, “We speak for those who cannot speak, and we remember all the victims, including our family members who perished needlessly,” Marilyn Wallach said. “It is our hope that through education we can ensure that lives will be saved, and history will not be repeated.”

More than 100 guests gathered for the kickoff celebration, including numerous other donors who have followed the Wallachs’ lead by making additional gifts in support of the building and its programs.

“The work we undertake today will stand as a national model of how a university can lead with principle and act with purpose,” said FAU President Adam Hasner. “As some universities across the nation struggle to confront antisemitism, the Wallach building rises from a profound responsibility that calls to us with urgency. We are taking steps to become the safest and most welcoming university for Jewish life in America, and we are honored that Kurt and Marilyn Wallach’s story has become part of our legacy here at Florida Atlantic.”

The Wallach building will be the home of Florida Atlantic’s Arthur and Emalie Gutterman Family Center for Holocaust and Human Rights Education; Holocaust education and Jewish studies programs; the Leon Charney Diplomacy program; and the Center for Peace, Justice and Human Rights, all housed within the Dorothy F. Schmidt College of Arts and Letters.

It also will be a South Florida destination for people seeking first-hand knowledge about the Holocaust as they tour the building’s permanent exhibits − the Craig and Barbara Weiner Holocaust Museum of South Florida at Florida Atlantic University and the George and Irina Schaeffer Dimensions in Testimony interactive display. Visitors also can spend time in quiet reflection within the Marta and Jim Batmasian Memorial Pavilion, which is dedicated to the memory of 1.5 million Armenians who died in the Armenian genocide.

The building also will feature a recital/lecture hall and a traveling exhibition hall off the prominent Marilyn and Jay Weinberg Grand Lobby. On the second floor, there will be a conference room, student study space and administrative offices for the programs.

“This wonderful building unleashes opportunities for both students and the community who will learn from the past to create a better world for the future,” said Michael Horswell, Ph.D., dean of the Dorothy F. Schmidt College of Arts and Letters. “We are indebted to Kurt and Marilyn for their transformational lead gift to the building and to all the generous benefactors who have linked arms with us to make Florida Atlantic an epicenter of Holocaust and human rights education.”

For more information, contact Laurie Carney at 561-297-3606 or lcarney@fau.edu.

If you are experiencing difficulty accessing information on the Florida Atlantic University website due to a disability, visit the website accessibility page.","https://www.fau.edu/newsdesk/articles/fau-kicks-off-construction-of-wallach-building.php"
"The Role of the Courts in Interpreting the Constitution","Florida Supreme Court Justice Renatha Francis.

Florida Atlantic University’s Dorothy F. Schmidt College of Arts and Letters presents the 2025 Constitution Day lecture, “The Role of the Courts in Interpreting the Constitution” with Florida Supreme Court Justice Renatha Francis on Monday, Sept. 15 at 10 a.m.  in the Osher Lifelong Learning Society’s Barry and Florence Friedberg Auditorium, 777 Glades Road, Boca Raton campus.

Francis is the 92nd justice and the first Jamaican-American appointed to the state's highest court. She will share insights from her inspiring journey — from her early life in Kingston, Jamaica, to her distinguished legal career across Florida’s judicial system. This timely conversation will explore the role of the courts in American constitutional democracy.

This event is sponsored by FAU’s School of Communication and Multimedia Studies; Department of Political Science; Division of Student Affairs; and the Osher Lifelong Learning Society.

Tickets are $10 and are available at fauevents.com or 561-297-6124. Lifelong Learning students can purchase tickets through OLLI at FAU.

If you are experiencing difficulty accessing information on the Florida Atlantic University website due to a disability, visit the website accessibility page.","https://www.fau.edu/newsdesk/articles/constitution-day-2025.php"
"FAU Provost Russell Ivy, Ph.D., Earns National APLU Award","FAU’s Interim Provost and Vice President for Academic Affairs, Russell Ivy, Ph.D., is the winner of the 2025 Michael P. Malone International Leadership Award.

Florida Atlantic University’s Interim Provost and Vice President for Academic Affairs, Russell Ivy, Ph.D., is the winner of the 2025 Michael P. Malone International Leadership Award, given annually by the Association of Public and Land-grant Universities. This national honor recognizes the lifetime achievement and outstanding contributions of individuals who advance international education at public universities.

“It is an honor to be recognized by the APLU for something that is a great passion of mine,” said Ivy. “I value the international connections I made as a student, and I am happy to have had the opportunity to be part of bringing that experience to the FAU community.”

Ivy also currently oversees the Center for Global Engagement, which he was instrumental in establishing nearly a decade ago. This centralized hub has brought together international student services, study abroad, intensive English programs and employment-based immigration services, supporting the “Global Perspectives and Participation” platform of the university’s 2015-25 strategic plan. Ivy’s dedication, mentorship and strategic vision has further strengthened FAU’s global footprint.

“Success is a standard outcome for international students at Florida Atlantic, and it is propelled by the strategies and support systems that Dr. Ivy initiated,” said FAU President Adam Hasner. “We are incredibly proud of all that he has done to further international education and global engagement at Florida Atlantic, which have benefitted both our university and local community.”

The Center for Global Engagement provides programs to help international students at FAU achieve academic and career goals. International enrollment has grown to more than 2,000 students from more than 100 countries, who contribute to the university’s vibrant community, giving all students exposure to a wide variety of perspectives, ideas and traditions.

“Congratulations to Russell Ivy on winning the 2025 Michael P. Malone International Leadership Award,” said Mark Becker, president of APLU. “As a champion of international engagement for more than 30 years, his work to advance global impact and international collaboration has enhanced FAU’s education, research and community engagement mission and helped bolster critical international engagement in the higher education sector.”

APLU’s Office of International, Community, & Economic Engagement leads the association’s wide array of international initiatives. These initiatives help support campus internationalization, enhance and expand study abroad opportunities, strengthen engagement with the developing world, and support members’ efforts to engage with partners worldwide to address global challenges.

If you are experiencing difficulty accessing information on the Florida Atlantic University website due to a disability, visit the website accessibility page.","https://www.fau.edu/newsdesk/articles/fau-provost-russell-ivy-earns-national-aplu-award.php"
"FAU Publishes Initial Annual Report: Florida Office of Ocean Economy","Housed at FAU, the Florida Office of Ocean Economy was created to position the state as a global leader in ocean-linked industries.

Few places in the world are as closely tied to the ocean as Florida. From our working waterfronts and bustling ports to fishing, tourism and recreation, the ocean is not just a natural asset; it is a cornerstone of our state’s economy and identity.

As such, in 2024 the Florida legislature selected Florida Atlantic University to house its Florida Office of Ocean Economy, a state effort to better understand, support and grow the ocean and coastal-based industries that drive jobs, investment and innovation across the state. FAU has published its initial annual report for the Florida Office of Ocean Economy.

Established by the Florida legislature in 2024 under the visionary leadership of the Florida legislature and Gov. Ron DeSantis, the Florida Office of Ocean Economy was created to position the state as a global leader in ocean-linked industries. Serving as a central hub for collaboration across business, research, capital and policy, the office is building the foundation for a thriving ocean economy.

“Florida Atlantic is proud to be the home of the state’s Office of Ocean Economy, a vital initiative advancing economic growth through the sustainable use of our ocean and coastal resources,” said FAU President Adam Hasner. “As a nationally recognized leader in marine science, ocean engineering and environmental research, Florida Atlantic is deeply committed to driving innovation, protecting ecosystems and preparing the next generation of talent. We look forward to working alongside our partners to cultivate an ocean economy that delivers opportunity, security and prosperity for every Floridian.”

Florida’s ocean economy is a vital and complex system that fuels prosperity across the state and serves as a cornerstone of its identity. With thousands of miles of coastline and a vibrant marine and coastal landscape, Florida supports a diverse set of industries that rely on healthy ocean resources, from ports and seafood to tourism and recreation. In 2023 alone, ocean-related activity sustained approximately 909,000 jobs, generated $59 billion in labor income and contributed $96 billion in Gross State Product. This represents more than 6% of the state’s total economic output, making Florida not only the largest ocean economy by employment in the United States, but also one of the most ocean-dependent economies in the world.

Florida’s ocean economy is guided by a robust framework of state initiatives and programs that sustain the economic productivity of coastal regions while protecting vital marine resources. From strategic port investments and aquaculture development to coastal resilience and beach renourishment, the state’s policy architecture enables Florida to lead the nation in ocean-related employment and economic activity.

The Florida Office of Ocean Economy will continue to collaborate closely with a diverse network of partners across sectors and disciplines. Key partners include state agencies and academic institutions such as the Florida Institute of Oceanography and other universities; federally funded research centers; industry leaders in marine transportation, tourism, aquaculture and renewable energy; nonprofit organizations focused on ocean conservation; federal agencies including NOAA and the U.S. Department of Energy; and private sector innovators driving marine technology and infrastructure development. This broad coalition strengthens Florida’s ocean economy by aligning resources, expertise and strategic vision toward sustainable growth and resilience.

If you are experiencing difficulty accessing information on the Florida Atlantic University website due to a disability, visit the website accessibility page.","https://www.fau.edu/newsdesk/articles/florida-office-ocean-economy-annual-report.php"
"FAU Earns 2025 Eduventures Innovation Award","Florida Atlantic University is one of just four higher education institutions in the nation to be recognized with the 2025 Eduventures Innovation Award, presented annually by Eduventures Research.

Florida Atlantic University is one of just four higher education institutions in the nation to be recognized with the 2025 Eduventures Innovation Award, presented annually by Eduventures Research.

Each year, the award showcases schools that embrace innovation, and the 2025 Eduventures Summit highlighted contributions that included pioneering advancements in AI education, dual enrollment and online student success.

“Florida Atlantic is a national university on the rise, and we are incredibly proud to spotlight our Online Enrollment and Student Success team as a model for targeted support,” said Russell Ivy, Ph.D., Interim Provost and vice president for academic affairs, said. “The team’s approach ensures that working students can balance their competing obligations while feeling seen, supported and connected in their online educational journeys.”

Florida Atlantic received the 2025 Eduventures Innovation Award in the Student Experience category, honoring the work of the Center for Online and Continuing Education and its Comprehensive Support Model for Online Student Success and Belonging.

This initiative stood out for its:

Eduventures recognizes higher education institutions transforming the student experience through creative, effective and scalable innovations. The awards honor institutions that have gone beyond traditional models to solve critical challenges in enrollment, student success and program innovation. A panel of judges made up of higher education leaders and analysts selects winners based on criteria such as novelty, impact and potential for replication.

If you are experiencing difficulty accessing information on the Florida Atlantic University website due to a disability, visit the website accessibility page.","https://www.fau.edu/newsdesk/articles/fau-earns-2025-eduventures-innovation-award.php"
"Narwhals may be using their tusks to play, new study finds","Scientists say they have the first recorded video evidence of narwhals using tusks not only to strike and manipulate fish during feeding but also engage in what appears to be playful behavior, according to the latest research.... more","https://www.cnn.com/2025/03/08/science/narwhal-tusks-play-behavior/index.html"