"Runoff set for Fort Pierce District 2 City Commission seat","NewsTreasure CoastRegion St Lucie CountyFort Pierce Runoff set for Fort Pierce District 2 City Commission seat after special election The runoff election is scheduled for January 13, 2026, and only District 2 residents will be eligible to vote WPTV By: Michael Hoffman Posted and last updated FORT PIERCE, Fla. — The race for Fort Pierce’s next City Commissioner isn’t over yet. With no candidate winning a majority in Tuesday’s special election, voters will head back to the polls in January for a runoff between Chris Dzadovsky and Jaimebeth Galinis.The District 2 seat has been vacant since James Taylor resigned earlier this year following 24 counts of child exploitation charges. His resignation forced the city to call a special election to fill his position.For residents like Iola Mosley, who has called Fort Pierce home for nearly a decade, the process has been frustrating. Runoff set for Fort Pierce District 2 City Commission seat after special election “I love Fort Pierce,” Mosley said. “Everyone is polite, you know. And it's a good feeling when you know your neighbors are really neighbors and look out for you. And that's what I get from Fort Pierce.”But she says that the sense of trust has been shaken.“To have this expense and to have to be forced to have a special election, it just breaks my heart,” Mosley said.The city says the runoff election will cost roughly $60,000 — money that some voters say could be spent elsewhere.“It is a lot. Yeah, that is not ideal,” said Marie-Ann Kessler.“There are other things that you could put the money towards — beautifying the city, beautifying certain parts of Fort Pierce — but you can't put that money towards that now, because now you have to do a runoff election,” said Pamela Turner.Voters tell WPTV that what they want most in their next commissioner is simple: accountability.“We need more accountability,” Turner said.The runoff election is scheduled for January 13, 2026, and only District 2 residents will be eligible to vote. Sign up for our Morning E-mail Newsletter to receive the latest headlines in your inbox. window.addEventListener('message', });","https://www.wptv.com/news/region-st-lucie-county/fort-pierce/runoff-set-for-fort-pierce-district-2-city-commission-seat-after-special-election"
"How IRC schools might address low enrollment and financial concerns","NewsEducation Indian River County schools consider restructuring to address low enrollment and financial concerns District leaders say changes could include combining schools and adding programs, while parents express concern about possible impacts. WPTV The School District of Indian River County's headquarters during the 2023-24 academic year. By: Cassandra Garcia Posted VERO BEACH, Fla. — The School District of Indian River County is considering major restructuring over the next two years as it looks for ways to increase enrollment and remain financially stable.Currently, the district is operating at a 72% capacity with a goal of reaching more than 90%. Superintendent Dr. David Moore said new programs could help attract more students and prevent financial strain.“If we want to hold true to the structures that are not yielding full schools, we will be financially bankrupt,” Moore said. Indian River County schools face funding concerns That statement has raised concerns among some parents, including Michael Marsh.“When you hear the word bankrupt, that’s a heck of a word to use, a very scary word,” Marsh said.At a recent board meeting, Superintendent Moore explained that the district may need to combine or move some schools while developing innovative ways to appeal to families.“If we don’t right-size and enhance what we’re offering to our community, then we will—shame on us,” Moore said.Marsh said he worries that merging schools could lead to overcrowding and affect the district’s A-rating.“You’re not [just] changing a school name. You’re deciding to send all these students to these schools,” he said.Superintendent Moore emphasized that any changes will be rolled out gradually and with community input.“It will not be a rushed process, it will not be a process in which things are happening in isolation,” Moore said. “We’re probably taking the hardest, longest, most complex way of doing this work, but it’s the right way.”Some of the feedback has already begun. In a statement to WPTV, the superintendent said, ""conversations with school leaders began in early October, followed by teacher and staff meetings during the week of October 27 at Glendale Elementary, Oslo Middle, Osceola Magnet, Rosewood Magnet, Sebastian Elementary, Storm Grove Middle, and the Freshman Learning Center.""The next step will involve gathering input from families at all affected schools. Family and informational sessions are scheduled for Nov. 11–13, with additional town hall meetings planned later in November in both North and South County.Marsh said he hopes the district listens closely to community voices.“This can’t come from up top. We need to hear from everyone, so I guess it’s kind of mixed emotions,” he said.Portions of this story were assisted by artificial intelligence tools and reviewed by a WPTV journalist to ensure accuracy, clarity, and adherence to editorial standards. Sign up for our Morning E-mail Newsletter to receive the latest headlines in your inbox. window.addEventListener('message', });","https://www.wptv.com/news/treasure-coast/region-indian-river-county/indian-river-county-schools-consider-restructuring-to-address-low-enrollment-and-financial-concerns"
"These are the 4 cities in Palm Beach County New Yorkers are relocating to","MoneyReal Estate News Surge of New Yorkers relocating to these 4 Palm Beach County cities, real estate agents say WPTV's Joel Lopez is uncovering that many NYC residents have already initiated what’s being dubbed the 'Mamdani Migration' as people are looking to make South Florida their new home full-tim WPTV By: Joel Lopez Posted and last updated PALM BEACH COUNTY, Fla. — All eyes are on South Florida from New York City residents, wanting to move from the Big Apple now that Zohran Mamdani is officially the NYC Mayor.WATCH BELOW: 'The last two weeks, it’s been completely a game changer,' CEO Talbot Sutter tells WPTV's Joel Lopez These are the 4 cities in Palm Beach County New Yorkers are relocating to The recent political shift in New York City, with Mamdani built his campaign around making New York City more affordable, but his policies have raised concerns among some about potential tax increases and policy changes from his administration. WPTV has uncovered that many NYC residents have already initiated what’s being dubbed the “Mamdani Migration” as people are looking to make South Florida their new home full-time.Rising demand in real estateThe real estate offices of Sutter & Nugget in North Palm Beach told WPTV's Joel Lopez, the Palm Beach County market is getting a surge in demand.“The last two weeks, it’s been completely a game changer,"" said CEO Talbot Sutter.He said his NYC clients have been a mix of seniors, families, residents and workers whose companies are relocating to South Florida.To meet this surging demand, Sutter shared that they are “having to hire more members to our team to handle the demand from New Yorkers wanting to move down.”So, where are NYC residents looking to move down to? National Politics Mamdani makes history in NYC mayor’s race: 'We have toppled a political dynasty' Scripps News Group Sutter revealed that the top cities his NYC clients are targeting include Jupiter, Palm Beach Gardens, Delray Beach, and Boca Raton.Impacts from the migration was further evidenced by recent offers.""We’ve had directly two offers that were stalemated over the summer that we’ve had three showings Monday and Tuesday and offers today, Wednesday. Because of the race. Directly out of the buyer's mouth, they said they were waiting until Wednesday, and we got the offer this morning,"" Sutter said, emphasizing that issues surrounding taxes and quality of life are significant motivators for these NYC transplants.In the past few years, Sutter estimates that around 30,000 New York residents have moved into Palm Beach County and Broward County.Inventory concerns“As far as inventory goes, are you seeing room for all these people?” Lopez asked.“I’m seeing a lot of what I call a 'coke bottle' effect where it's an influx of people, and not enough inventory. Some people say inventory is up right now. We were just looking at stats this morning 56% from year to year, but that inventory is also being scooped up in the last month like that,"" Sutter replied.Despite the year-to-year increase in inventory, Sutter insists that “that inventory is also being scooped up in the last month like that.”Boca Raton's appealOn Tuesday, WPTV spoke with Boca Raton Mayor Scott Singer about the city’s efforts to attract NYC businesses and have them relocate their corporate offices to the Boca Raton.After hearing concerns from Boca Raton residents on the growth this may create, Lopez posed the question: “Wouldn’t you say that also some residents in New York would also see the opportunity to come down here as residents?”Singer acknowledged the potential influx.“We will expect to see that, but we can’t accommodate everyone,"" Singer stated. ""We’re a fairly built-out city. We might have people trying to buy homes here but we're not building to accommodate everyone who wants to come from New York.” WATCH BELOW: 'We’re focused on the businesses,' Mayor Scott Singer tells WPTV Could NYC mayoral election trigger surge in migration to South Florida He elaborated that new building projects aren’t primarily aimed at incoming residents but focus on creating space for NYC businesses that have already committed to relocating to the area.Singer calls Boca Raton the economic engine of Palm Beach County, highlighting that it is home to 40 publicly traded companies from industries such as financial services, financial technology, medical technology, AI, quantum computing, manufacturing and more. “I think that's great; it provides the job and economic vitality we need in ensuring jobs for the next generation and beyond,” Singer remarked.Economic impactSutter acknowledges the potential for increased traffic but suggests “where companies come, residents will follow.”He noted New York residents alone have contributed $9.2 billion in revenue to South Florida.Sutter went through his inventory platform and told WPTV there are over 5,000 single-family houses available for purchase throughout Palm Beach County. Politics Could NYC mayoral election trigger surge in migration to South Florida? Joel Lopez However, Sutter fears that this inventory may not be enough, predicting they could be sold within the next three months from the surge in NYC residents.“I've seen West Palm as the Wall Street—not the new Wall Street—and I see the area exploding,” he warned.To navigate the shifting landscape, Sutter has observed that his NYC clients are open to settling in communities further west.He said he has also heard from people in states like Illinois and California expressing interest in South Florida.Advice for potential moversDespite the fervent interest in relocating, Sutter advises potential movers to take their time. “Don't rush into a property and research the areas,” he advised.He recommends buying property in a neighborhood that is in close proximity to work, ensuring a smoother transition for new residents. Sign up for our Morning E-mail Newsletter to receive the latest headlines in your inbox. window.addEventListener('message', }); HOUSING RESOURCESCounty-by-county resources for renters facing evictionOUR Florida - Emergency Rental Assistance Relief ProgramPalm Beach County Department of Housing and Economic DevelopmentPalm Beach County Community ServicesBoca RatonSt. Lucie CountyMartin CountyIndian River CountySEEKING SOLUTIONS'Priced Out of Paradise' town hall'Coverage Collapse' town hall'Coverage Collapse' special - March 11, 2024'Coverage Collapse' special, WPTV asks CEOs tough questions - June 27, 2024WPTV hosts live town hall in Port St. Lucie on Florida's insurance crisis - Sept. 17, 2024","https://www.wptv.com/money/real-estate-news/surge-of-new-yorkers-relocating-to-these-4-palm-beach-county-cities-real-estate-agents-say"
"Family of woman killed after seeking help from police files lawsuit","NewsPalm Beach CountyRegion S Palm Beach CountyBoynton Beach Family of Boynton Beach woman killed after seeking help from police files wrongful death lawsuit Nearly 2 years after Fridelene Daniel was shot and killed outside her home, her family is suing the city and a police officer they say failed to protect her WPTV Police body came footage of Fridelene Daniel. By: Ange Toussaint Posted and last updated BOYNTON BEACH, Fla. — Nearly two years after a Boynton Beach mother was shot and killed outside her home, her family is suing the city and a police officer they say failed to protect her, even after she went to police for help.“I really don’t understand how my mother walked inside of a police station, a man that is threatening her life followed her in there, and the officer thinks it was just OK to let them walk out,” said Fridelene Daniel’s daughter.WATCH: Daughter says police failed to protect her mother Family files wrongful death suit against Boynton Beach Daniel was killed outside her Boynton Beach apartment in November 2023, just hours after she filed a complaint against her ex-boyfriend, Robens Cesar. “Even looking at the video, Robens is there menacing my mother,” her daughter said. She was just 16 years old at the time. “I got a phone call from my aunt and she was freaking out, saying I heard gunshots,” she recalled.Now, Daniel’s daughter has filed a wrongful death lawsuit accusing the city of Boynton Beach and Officer Jermaine Jones of failure to protect her mother from Cesar. Frideline Daniel Complaint by Megan Agugliaro “Somebody walks in, asks you for help and you do absolutely nothing, you just let them walk out,” she said.According to police reports, Daniel told Officer Jones that Cesar was following her and that he owned a gun. Body cam video shows Cesar standing inside the Boynton Beach Police Department lobby as Daniel made her complaint that morning. You can hear Daniel tell police, “He keeps following me. I don’t want that.”Cesar later told investigators he “couldn’t stand to see Daniel with another man.” An internal affairs investigation later revealed Officer Jones claimed there was some misunderstanding at first, saying Daniel, who was from Haiti and spoke with a Creole accent, may have been misunderstood when she said the word “gun.” Jeff Ringrose/WPTV Robens Cesar, 41, appears in court in Palm Beach County, Fla. on Nov. 9, 2023. The lawsuit alleges Officer Jones failed to conduct a proper investigation and neglected to take immediate action to ensure Daniel’s safety.“We have a police force that took an oath to serve and protect,” said attorney Gary Susser, who represents Daniel’s daughter.Officer Jones was suspended for two weeks following the internal investigation, but Susser says that isn’t enough. “When you have a woman seeking help, literally being stalked and harassed, and literally followed into the police station, nothing was done. And that is egregious conduct,” Susser said.A spokesperson for the Boynton Beach Police Department said the city will respond through legal channels. Cesar, who is charged with first-degree murder, is still awaiting trial. Sign up for our Morning E-mail Newsletter to receive the latest headlines in your inbox. window.addEventListener('message', });","https://www.wptv.com/news/region-s-palm-beach-county/boynton-beach/family-of-boynton-beach-woman-killed-after-seeking-help-from-police-files-wrongful-death-lawsuit"
"New York City to Florida, affordability remains the top issue","Money New York City to Florida, affordability remains the top issue Florida lawmakers from both parties prioritize putting money back in residents' pockets Shutterstock A person looks at a bill while using their phone. By: Matt Sczesny Posted WEST PALM BEACH, Fla. — Economic concerns dominated voters' minds in Tuesday's elections, leading to Democratic victories in New York City, New Jersey, Virginia and California as the party pledges to address affordability issues.When Zohran Mamdani won the New York City mayor's race, he largely did it by focusing on an issue that stretches from red states to blue states: the cost of living.WATCH BELOW: New York City to Florida, affordability remains the top issue Affordability remains top issue in red & blue states ""This is essentially the same issue that got Donald Trump elected president, it's inflation, it's lack of affordability,"" said Dave Aronberg, a former Florida state senator and former Palm Beach County State Attorney. ""Essentially the same message that prices are too damn high.""As New York City wrestles with affordability issues, the same can be said for Florida, where a recent FAU poll showed about 50% of residents have considered moving because of the cost of living, with insurance, property taxes and inflation among the top factors.""Affordability issues are broader and harder to tackle for any one politician,"" Aronberg said. ""It's not like you can push a button or turn a switch and then things are less expensive.""In Florida, both Republican and Democratic lawmakers have targeted affordability as a top issue.Democrats are proposing several bills to reduce the cost of homeowners insurance, while Republicans are taking aim at reducing property taxes.""My job is to find some way to put money back in the pocket of Floridians,"" state Rep. Toby Overdorf, R-Stuart, said. ""We're approaching $60 billion just for property taxes across our state. I sincerely believe there is some opportunity now for a pullback of that revenue within local government.""Others point out that reducing or eliminating property taxes will only shift costs elsewhere, which is also directed at the agenda of Mamdani as he gets ready to take office Jan. 1.""When Mamdani campaigns on lowering prices, you're not going to get there by rent control and free buses,"" Aronberg said. ""It's just going to put the higher costs elsewhere. You'll have less housing and maybe free buses, but who will pay for it?""This story was reported on-air by a journalist, and portions have been converted to this platform with the assistance of AI. Our editorial team verifies all reporting on all platforms for fairness and accuracy. Sign up for our Morning E-mail Newsletter to receive the latest headlines in your inbox. window.addEventListener('message', });","https://www.wptv.com/money/new-york-city-to-florida-affordability-remains-the-top-issue"
"'Everybody is hurting from this': TSA workers speak out about struggles","LifestyleTravel Government shutdown reaches historic 36 days as TSA workers struggle without pay TSA workers who are no longer being paid are speaking to WPTV about the mounting challenges they face WPTV ""Everybody is hurting from this,"" said William Watts, a TSA officer and veteran who is manning the front lines. By: Kayla McDermott Posted and last updated PALM BEACH COUNTY, Fla. — The federal government shutdown has entered its 36th day, officially becoming the longest shutdown in U.S. history as Republicans and Democrats remain locked in a standoff over health care with neither party willing to budge.President Donald Trump summoned Senate Republicans to the White House this morning, where he blamed the shutdown for Tuesday's election results and urged lawmakers to eliminate the filibuster. Doing so would allow Republicans to pass bills with a simple majority without Democratic support. Government shutdown reaches historic 36 days as TSA workers struggle without pay ""If you don't terminate the filibuster, you'll be in bad shape. We won't pass any legislation. There'll be no legislation passed,"" Trump said.While some signs on Capitol Hill suggest negotiators could be making progress, with lawmakers expressing cautious optimism that a deal could be reached by the end of the week, Democrats claim it all depends on the White House.Meanwhile, TSA workers who are no longer being paid are speaking out about the mounting challenges they face. These federal employees continue working despite being cut off from paychecks and some benefits, with many unsure how much longer they can last.""Everybody is hurting from this,"" said William Watts, a TSA officer and veteran who is manning the front lines. ""I shouldn't be treated this way working for the federal government."" Travel TSA workers face paycheck uncertainty as shutdown continues Kayla McDermott Watts described the difficult conditions workers face daily. ""We're expected to come in each day with a smile on our face under the tumultuous stress of the general public,"" Watts said. ""There's no relief, there's no aid.""Mickey Alston, a representative with AFGE Local 558, a federal union representing seven airports in the area, has been receiving daily calls from federal workers begging for help. ""I myself just had a medical procedure done yesterday and I had to beg just to try and get a deferment,"" Alston said. ""We can't buy medication because we don't have a check. That is very demoralizing.""Alston noted the urgency of housing situations for affected workers as some workers won't even have a place to live soon. ""Some rental places only give you a week tops to actually pay rent and mortgages,"" Alston said. At Orlando International Airport, fellow union representative for AFGE Local 556, Tatiana Finlay, is also a TSA officer along with her husband. She described the personal toll on families. Travel Local airports face widespread flight delays as shutdown nears record length Kayla McDermott ""These things are hard to explain to our families. How do I explain to them mommy is having a hard time putting food on the table?"" Finlay said.Finlay has witnessed shortages in air traffic control and TSA staffing, and expressed concern about potential disruptions as Transportation Secretary Sean Duffy warns of potential mass chaos in the skies. ""It is very scary for the traveling public,"" Finlay said. For Watts, his motivation to keep coming to work remains his family, despite the financial hardship. ""I got a 10-year-old baby girl at home,"" Watts said. ""We just sit on our hands and hope."" Finlay emphasized the human cost of the political standoff. ""It's time for them to stop taking our livelihoods as a bargaining chip,"" Finlay said.To help, Alston says the best thing people can do is to continue to donate to food banks, as well as to the Combined Federal Campaign. This story was reported on-air by a journalist and has been converted to this platform with the assistance of AI. Our editorial team verifies all reporting on all platforms for fairness and accuracy. Sign up for our Morning E-mail Newsletter to receive the latest headlines in your inbox. window.addEventListener('message', });","https://www.wptv.com/lifestyle/travel/government-shutdown-reaches-historic-36-days-as-tsa-workers-struggle-without-pay"
