"5th arrest made in connection with Sara Sims Park shooting","NewsPalm Beach CountyRegion S Palm Beach CountyBoynton Beach 5th arrest made in connection with Sara Sims Park shooting in Boynton Beach Travonte Edwards, 21, was wanted on charges related to a July 5 shooting at a 'Peace in the Hood' event WPTV/Boynton Beach Police Department Travonte Edwards By: Audra Schroeder Posted BOYNTON BEACH, Fla. — The Boynton Beach Police Department has arrested a fifth person wanted in connection with a shooting at Sara Sims Park in July. Travonte Edwards, 21, was arrested with assistance from the U.S. Marshals and Palm Beach County Sheriff’s Office Warrant Division. Police are still searching for Tevens Darnell Bradley, 19, who is also wanted in connection with the shooting. Boynton Beach 4th arrest made in connection to Boynton Beach park shooting, video released Aja Dorsainvil Police claimed a dispute between ""rival gang members"" led to three women being shot at a ""Peace in the Hood"" event on July 5. WPTV later learned a permit for that event was denied by the city. D'Andre Leger Jr., 20; Kenneth Hollis, 25; Jamarion Petty, 19; and Javon Johnson, 19, have previously been arrested in connection with the shooting. MORE COVERAGE: Boynton Beach 'REALLY TROUBLING': Victim shot at peace event intends to sue city Aja Dorsainvil Boynton Beach 2 suspects wanted in connection to shooting at Sara Sims Park Aja Dorsainvil Boynton Beach 3rd arrest made in Boynton Beach park shooting Samantha Roesler Boynton Beach Additional arrest made in connection with gang shooting at Boynton Beach park Samantha Roesler Boynton Beach Teen arrested in shooting that injured 3 women Samantha Roesler","https://www.wptv.com/news/region-s-palm-beach-county/boynton-beach/5th-arrest-made-in-connection-with-sara-sims-park-shooting-in-boynton-beach"
"'May be more victims': Vero Beach physician arrested for battery","NewsTreasure CoastRegion Indian River County Doctor accused of inappropriate touching at East Side Urgent Care in Vero Beach, sheriff says Dr. Christopher David Olenek, 62, was arrested Thursday and has 9 investigations of inappropriate behavior dating back to 2011, according to the Indian River County Sheriff's Office WPTV/James Bailey By: Aja Dorsainvil Posted and last updated INDIAN RIVER COUNTY, Fla. — A physician at an Indian River County urgent care clinic was arrested Thursday following the ninth investigation into allegations of inappropriate touching, prompting law enforcement to seek additional victims who may have experienced similar incidents.WATCH BELOW: Vero Beach physician arrested for battery Dr. Christopher David Olenek, 62, who practices at East Side Urgent Care located at 927 37th Place, was taken into custody on a simple battery charge after a job applicant reported being inappropriately touched during the hiring process, according to the Indian River County Sheriff's Office.Sheriff Eric Flowers said the arrest came after reviewing eight previous investigations dating back to 2011 involving similar allegations against Olenek. The cases involved former employees and individuals seeking medical care or other services at the clinic.""We have hundreds of physicians in Indian River County. Rarely do we have anybody come in and make a complaint against a physician,"" Flowers said during a news conference on Friday. ""For us to have somebody who has eight prior cases and the ninth one that just happened, is very problematic. We believe there are likely dozens of victims that are out there who have experienced similar episodes over at his office.""The sheriff's office said many of the previous cases could not be prosecuted due to the statute of limitations or lack of sufficient evidence. The confidential nature of doctor-patient relationships in examination rooms made it difficult to obtain witnesses or surveillance footage, Sharpeta said.WATCH BELOW: Indian River County Sheriff's Office discusses Vero Beach physician's arrest Indian River County sheriff discusses Vero Beach physician's arrest During questioning, Olenek maintained his actions were within the normal scope of his duties as a physician and denied wrongdoing, according to detectives.""He claims that he has no idea why these women would come forward and single him out specifically, but the evidence just shows differently,"" Sharpeta said.A witness at the clinic noted suspicious behaviors and described comments Olenek made as ""creepy,"" though she did not witness inappropriate touching directly, investigators said.Olenek was released on $5,000 bond and returned to work at his clinic on Friday, the sheriff's office said, as the battery charge was a misdemeanor. His medical license has not been revoked. WPTV Detective Chad Sharpeta gives more details on the arrest of Dr. Christopher David Olenek as he is leading the case against Olenek. The sheriff's office is using the Williams Rule, which allows prosecutors to present evidence of similar past incidents to establish patterns of behavior, even if those cases are beyond the statute of limitations.""We're essentially trying to build a pattern here,"" Flowers said. ""We want to be able to show that this is something that's been going on for some time.""Investigators are asking anyone who has experienced inappropriate behavior at East Side Urgent Care to contact the Indian River County Sheriff's Office.The sheriff's office said it plans to share all information with the Department of Health and other regulatory agencies that oversee physicians.","https://www.wptv.com/news/treasure-coast/region-indian-river-county/indian-river-county-sheriff-to-discuss-vero-beach-physicians-arrest"
"Can drones stop another school shooting in Florida?","NewsLocal NewsWPTV Investigates Inside the Texas start-up bringing drones to Florida schools to stop school shootings Florida to become first state to fund pilot program Florida is set to become among the first states in the country to test cutting-edge drone technology designed to stop school shooters before they can kill. By: Katie LaGrone Posted FLORIDA — Florida is set to become among the first states in the country to test cutting-edge drone technology designed to stop school shooters before they can kill. The state has approved $557,000 for a pilot program three school districts, marking a significant shift in how schools might respond to active shooter situations.The technology, developed by Campus Guardian Angel, a Texas-based start-up, uses professional drone pilots operating from a command center in Austin, Texas. The drones would be deployed within seconds of a school shooting alert. The system aims to distract, disorient or physically stop a shooter while buying crucial time for first responders. Watch full report from Katie LaGrone Inside the TX start-up bringing drones to Florida schools to stop school shootings ""Most of the death happens in the first two minutes,"" said Justin Marston, a cyber security expert and CEOP Campus Guardian Angel. ""So the challenge was, how do you get something that's instantaneous but elite and still affordable?""Marston said he came up with the idea after observing the effectiveness of small drones against armed individuals in Ukraine, combined with analyzing mass shootings like those at Parkland and Uvalde.“We feel in both of those, we could have engaged the shooter ahead of time,” he told Investigative Reporter Katie LaGrone.LaGrone recently visited the company’s headquarters in Austin. Military-Style command center The operation runs from what looks like a U.S. military command center, complete with multiple screens and a team of 11 specialists. Former Navy SEAL Bill King, who piloted Predator drones for the U.S. military overseas, is the co-founder of the company and is helping to lead drone operations.""We are leaning so far forward that only one pilot can go to the bathroom at a time,"" King said. ""Because if we're going to make a decision in five seconds.""The command center is set up to maintain a constant state of readiness with four pilots positioned on either side of the room and a commander in the center coordinating operations.A threat track will also be in position along with liaisons whose focus will be communication with locals on the ground, according to King. How the technology works Schools would be equipped with dozens of drones stored in strategic locations around campus. When an alert is triggered, encrypted drones designed for low delay are deployed within seconds by professional pilots controlling the devices remotely from Austin.The company’s anticipated timeline for engaging a shooter is precise: within five seconds, the drones are deployed; within 15 seconds, they've engaged the shooter; and within one minute, they've taken the shooter down.""We have some that are dedicated to window breaking. So, we can essentially pick which drone we want to use and go after them,"" said Mason Lively, a 25-year-old professional drone pilot and world champion drone racer recruited for the program.For Lively, joining Campus Guardian Angel was personal. He graduated high school in 2018 and grew up in Melbourne, Florida, with connections to the Parkland community.""I had friends of friends that went to Parkland, so I was very aware of that, and very aware of what happened there and then, when they talked about what they were going to do here, that's a big reason why I came up,"" Lively said.Despite the high-stakes nature of the work, Lively said he is ready and relies on preparation and constant training to manage his nerves about going into action once the program is up and running in schools.“I feel like once we’re in the scenario, we’re going to be ready to go.The nerves will disappear, and it will be just like any other event that we do,” he said. ‘Non-lethal distractors’ The drones are designed to employ various non-lethal distraction methods, from flashing lights and loud sirens to pellet bangs. If necessary, the pilots can physically engage a shooter by flying the drone into the shooter.In a demonstration on site, the pilot knocked down a dummy after it was struck head on.“It’s like a baseball bat, so it will hurt but not be lethal,” explained Lively.Other drones are designed to smash windows to further create a distraction.""If we can get a shooter to do anything besides shoot people, we're winning,"" King said. ""If you're shooting at the drone, great. We love that if you're trying to hit the drone with a broomstick, great. We love that if you're running from the drones, perfect.""The goal is to buy time for first responders and guide them to the shooter's exact location. Florida's school shooting crisis According to the K-12 School Shooting Database, Florida has reported among the most school shootings since the 2018 shooting at Marjory Stoneman Doughlas High School in Parkland, FL.To stop future shootings, Florida lawmakers approved a total of $557,000 in state funding for the drone pilot program during the last legislative session.While drones are expected to also launch at schools in Colorado, Virginia and Texas, Florida is the first state to approve state funding for the technology. Florida’s Department of Education has not yet announced which three school districts will participate in the pilot program, but an announcement is expected “before the end of the month,” according to a spokesperson with Campus Guardian Angel.King and Marston said among the most powerful voices they’ve heard in support of their drones came from Parland parent, Max Schacter whose 17-year-old son, Alex, was among the victims in Parkland.""The first time we showed it to him, he's like, I have seen a lot of stuff since my son died. This is the only thing I've seen that could have saved his life,"" King said.King described the endorsement as meaningful to the team's mission.""I mean, that's what we want to do,"" King said. ""The best feeling in the world is to rescue hostage. That's what we're going to do here.""""This story was reported on-air by Katie LaGrone and has been converted to this platform with the assistance of AI. Our editorial team verifies all reporting on all platforms for fairness and accuracy.""Send your story idea and tips to Katie LaGrone First Name Last Name Email Phone Phone Number Subject Tip Information I'm not a robot (function() { document.addEventListener(""DOMContentLoaded"", function() { if (!window.recaptchaLoaded) { var RECAPTCHA_SELECTOR = '.GoogleCaptcha', RECAPTCHA_UNCHECKED_CLASSNAME = 'CaptchaInput-error', DATA_FORM_DISABLE_SELECTOR = 'data-form-disabled', RECAPTCHA_LIBRARY = 'https://www.google.com/recaptcha/api.js?onload=recaptchaLoaded', recaptchas; var stopFormSubmit = }; // Polyfill for DOM 'closest' function for IE 9+ if (!Element.prototype.closest) { if (!Element.prototype.matches) { Element.prototype.matches = Element.prototype.msMatchesSelector || Element.prototype.webkitMatchesSelector; } Element.prototype.closest = function (s) { var el = this; if (!document.documentElement.contains(el)) return null; do { if (el.matches(s)) return el; el = el.parentElement || el.parentNode; } while (el !== null && el.nodeType === 1); return null; }; } window.recaptchaLoaded = function () { recaptchas = document.querySelectorAll(RECAPTCHA_SELECTOR); window.recaptchaDisable(); }; window.recaptchaEnable = function () { recaptchas.forEach(function (captcha) { let form = captcha.closest('form'); form.removeAttribute(DATA_FORM_DISABLE_SELECTOR); form.removeEventListener('submit', stopFormSubmit); captcha.classList.remove(RECAPTCHA_UNCHECKED_CLASSNAME); }); }; window.recaptchaDisable = function () { recaptchas.forEach(function (captcha) { let form = captcha.closest('form'); form.setAttribute(DATA_FORM_DISABLE_SELECTOR, ''); form.addEventListener('submit', stopFormSubmit); }); }; let scriptTag = document.createElement('script'); scriptTag.setAttribute('src', RECAPTCHA_LIBRARY); scriptTag.setAttribute('async', 'true'); document.querySelector('head').appendChild(scriptTag); } }); })(); Submit Florida beekeeper loses livelihood after neighbor has 20 beehives removed from his propertyAn 84-year-old Citrus County beekeeper is fighting to recover 20 active beehives that were taken from his property months ago, leaving him without his main source of income and removing up to 2 million bees from the local ecosystem. Florida beekeeper loses livelihood after neighbor has 20 beehives removed from his property Latest I-Team Investigations from Tampa Bay 28 Your loved one is in a nursing home with cases of COVID-19, what you should do Katie LaGrone","https://www.wptv.com/wptv-investigates/inside-the-texas-start-up-bringing-drones-to-florida-schools-to-stop-school-shootings"
"Let's Hear It: Osto Group founder remembered for her impact on people in need","NewsPalm Beach County Let's Hear It: Osto Group founder remembered for her lasting impact on people in need Stephanie Sullivan attended one of WPTV's first Let's Hear It events when she was worried about being priced out of their warehouse space Osto Group Marian Grace (left), Stephanie Sullivan (middle) and Barbara Hymans (right) By: Ashley Glass Posted and last updated PALM BEACH GARDENS, Fla. — The Osto Group is a West Palm Beach-based nonprofit that provides people with ostomy supplies during difficult times. One of the founders, Stephanie Sullivan, attended one of WPTV's first Let's Hear It events when she was worried about being priced out of their warehouse space. By putting attention on their story and mission to provide medical supplies, free of charge, to people all over the country recovering from bladder surgery, the Osto Group secured an affordable warehouse space to rent in Palm Beach Gardens. WATCH: Osto Group founder remembered for her lasting impact on people in need Unfortunately, Sullivan passed away after a hard-fought battle with her health and complications from a spinal cord injury she sustained in 1983 during a search and rescue mission with the U.S. Coast Guard. ""Stephanie excelled in everything she put her hand to whether it was nursing, physical therapy or medical massage therapy,"" Barbara Hymans, one of the co-founders of the Osto Group, said. ""It was Stephanie’s vision to keep Osto Group growing as a viable source of ostomy supplies for the less fortunate.""You can honor Sullivan's life and support the mission of the Osto Group by giving your time or financial resources. Connect with the Osto Group here.","https://www.wptv.com/news/palm-beach-county/lets-hear-it-osto-group-founder-remembered-for-her-lasting-impact-on-people-in-need"
"How a local good Samaritan changed a homeless man's life","NewsPalm Beach CountyRegion S Palm Beach CountyBoca Raton How a local good Samaritan changed a homeless man's life Peter Martin was homeless for over a year, until a stranger helped him find a job and a roof over his head WPTV Over the last weeks, Peter also returned to the kitchen, a craft he practiced years ago. By: Zitlali Solache Posted and last updated BOCA RATON, Fla. — A Boca Raton man is getting a fresh start after being homeless for more than a year and getting a helping hand from a local good Samaritan.WPTV’s Zitlali Solache caught up with Peter Martin, who we first reported on last month.WATCH: A stranger helped Peter Martin with a job and a roof over his head How an act of kindness changed a homeless man's life “I was homeless for a great amount of time, over 500 days. I picked a bench that I thought was pretty good for me and John came along,” said Martin.John Ferber, a Boca Raton good Samaritan, helped raise nearly $8,000 for Martin, enough for short-term housing in Delray Beach. Martin calls it a gift with no price tag.“It’s amazing how some people, for whatever reason, go beyond,” said Martin. Over the last weeks, Martin also returned to the kitchen, a craft he practiced years ago. Boca Raton Man raises $4K to help homeless person find housing Zitlali Solache It was through the help of Ferber that he now works for Potions in Motion, a private catering company in Boca Raton. Peter also took the time to thank us for shining his story. “I just want to say thank you,” said Martin. “To God, to my newfound friends, to the donors.” Last month, Ferber took Martin on a shopping spree for clothing and other necessities. Martin also sent a special message for Ferber, the new friend he gained that helped give him a second chance. “You’re a special guy,” said Martin. “You were able to see that somebody needed help and I’m more than grateful for what you’ve done.”","https://www.wptv.com/news/region-s-palm-beach-county/boca-raton/how-a-local-good-samaritan-changed-a-homeless-mans-life"
"Broken meters and rate increases continue to frustrate those visiting downtown","NewsPalm Beach CountyRegion S Palm Beach CountyDelray Beach Delray Beach parking pilot program draws criticism over meters and rate increases Employees and residents say the new program is taking time to get used to WPTV By: Ange Toussaint Posted and last updated DELRAY BEACH, Fla. — Delray Beach’s new paid parking rates and time limits in the downtown core continue to frustrate residents, visitors, and business owners, who say the rollout has been confusing and inconsistent. The changes, part of a pilot program that began Oct. 1, raised prices in garages and surface lots and introduced new limits on how long drivers can stay. WATCH: Frustrations mount over paid parking pilot program Delray Beach parking pilot program draws criticism over meters and rate increases For visitor John Durr, simply paying to park became its own challenge. “It’s confusing, I don’t want to say it could be easier, but it’s not so easy for me right now,” he said after struggling with a meter. Earlier, he tried to use a kiosk that displayed an error message. “The machine here is out of paper over here, I couldn’t get it to work,"" he said. Inside Silverball Retro Arcade, general manager Vincent Messera said his customers have been voicing similar frustrations. Employees who work downtown can pay $10 a month for parking permits, but he says that is not sitting well with staff. “It’s taking some time for employees and guests to get used to—they’re so used to free parking for how many years. I think awareness needs to increase so people know and they don’t get ticketed,” he said. WPTV A sign inside Silverball Retro Arcade in downtown Delray Beach. Longtime Delray Beach resident Rick Reeder criticized the city for what he sees as poor maintenance of the meters and a lack of preparation. “The cost of the parking is reasonable but when they give you a machine that begins the conversation with you by telling you the printer has no paper so you can’t get a receipt—that is miserable management of the parking facility system.” The city’s Public Works Department oversees the meters and upkeep. The issue of increased rates and public frustration was raised at a recent commission meeting, but city leaders agreed to keep the new structure in place until the pilot program ends in April. Delray Beach Parking price hike has local businesses worried about community impact Vannia Joseph In October, Mayor Tom Carney told WPTV reporter Joel Lopez, the city will be evaluating usage data before making any long-term decisions. “The city needs the revenues, the residents need to make sure their assets are being monetized properly,” he said. For those who rely on downtown parking, the hope is that the system becomes easier to navigate in the meantime. As Reeder put it, “If we’re gonna have these laws to collect these parking fees—which are reasonable, I don’t have a problem with that—then manage your system to facilitate it being done in a manner that’s professional and reflects well on the city.”","https://www.wptv.com/news/region-s-palm-beach-county/delray-beach/delray-beach-parking-pilot-program-draws-criticism-over-meters-and-rate-increases"