"UNCERTAIN FUTURE: Why a beloved tennis instructor may lose his job","SportsLocal Sports West Palm Beach tennis community concerned about instructor's future amid facility changes Longtime tennis director Skip Jackson left in limbo WPTV Tennis pro Skip Jackson By: Jon Shainman Posted and last updated WEST PALM BEACH, Fla. — Local tennis players are expressing concerns about the future of their beloved instructor as the city of West Palm Beach prepares to hand over operations of its tennis facilities to a new organization.The South Olive Tennis Center is set to reopen Dec. 1 after extensive renovations that transformed 12 courts into beautifully refurbished playing surfaces. However, the excitement over the facility's makeover is tempered by uncertainty surrounding longtime tennis director Skip Jackson's future role.WATCH BELOW: Future of beloved tennis coach left in limbo Beloved tennis instructor may lose his job During construction, Jackson has been conducting lessons at nearby Howard Park, maintaining his connection with students like Amber Grow, who has been under his tutelage for two decades.""I started playing tennis with Skip in 2001 when I was 15 years old,"" Grow said.She remembers the poor condition of the South Olive courts before the renovation project began.""The courts were empty, in poor condition, weeds growing out of them,"" Grow told WPTV Monday.When Grow moved back to the city, she reconnected with Jackson and the tennis community at South Olive.""He has also been such a welcoming, fun presence,"" Grow said. WPTV Amber Grow is among the tennis players upset about the future of longtime instructor Skip Jackson. While there's positive momentum around the facility improvements, the tennis community is concerned that Jackson, who helped build up the program over more than 20 years, may not be part of its future.""So what happens to you?"" WPTV asked Jackson. ""I'm looking for work,"" Jackson replied.The city of West Palm Beach recently agreed to turn over operations of the city's tennis facilities to the USTA starting Jan. 1, leaving Jackson's employment status uncertain. He's filing a protest with the city.""It's kind of like working for a union and having the union come and take your job,"" Jackson said. ""The USTA is there to support tennis professionals and tennis community. I would expect them to assist me in running the facility with grants etc., not take over the facility.""WPTV reached out to both the city of West Palm Beach and the USTA to ask about the change and whether Jackson will continue to have a role at the tennis center.A city spokeswoman said that because of the funding source for the renovations, they had to go out to bid rather than continue with the previous operating model.WPTV was also told that the city's intent is to negotiate terms with USTA Florida as to each of the three parks involved, including court fees and hiring tennis pros, which could include retaining the current pros serving each park.A USTA spokesman said that due to what it called a ""quiet period"" of contract negotiations, they are unable to comment at this time.This story was reported on-air by a journalist, portions have been converted to this platform with the assistance of AI. Our editorial team verifies all reporting on all platforms for fairness and accuracy.","https://www.wptv.com/sports/local-sports/west-palm-beach-tennis-community-concerned-about-instructors-future-amid-facility-changes"
"23-year-old man fatally shot in Fort Pierce","NewsTreasure CoastRegion St Lucie CountyFort Pierce 23-year-old man fatally shot in Fort Pierce WPTV Fort Pierce Police Department By: Scott Sutton Posted and last updated FORT PIERCE, Fla. — A 23-year-old man was gunned down in Fort Pierce on Monday, according to police.Officers responded to the 1200 block of North 27th Street at about 12:27 p.m. after receiving a 911 call.Police said when officers arrived at the scene, they learned that after an altercation involving a group of men, the victim sustained a gunshot wound.The 23-year-old victim was taken to a local hospital, where he was pronounced dead.The name of the victim has not been released.Police said a preliminary investigation indicated that this was an isolated incident and there is no active threat to the public.If you have any information regarding the shooting, contact the Fort Pierce Police Department at 772-462-6800 or Treasure Coast Crime Stoppers at 1-800-273-8477.","https://www.wptv.com/news/region-st-lucie-county/fort-pierce/23-year-old-man-fatally-shot-in-fort-pierce"
"Online extortion scheme reveals 'underworld of nefarious activities'","NewsLocal NewsWPTV Investigates West Palm Beach business owner among many targeted in Google reviews extortion scheme 'There's this whole underworld of nefarious activities underpinning what the public actually sees on Google,' Kay Dean, expert in online fraud, says WPTV WPTV investigative reporter Dave Bohman speaks with Gareth Larkin about the bogus reviews his company received from overseas. By: Dave Bohman Posted WEST PALM BEACH, Fla. — A West Palm Beach moving company owner claims he was the victim of an international extortion scheme after his business was bombarded with fake negative Google reviews, then offered a $200 deal to have them removed.Gareth Larkin's moving company had maintained a near-perfect online reputation with 70 of 72 reviews giving him five out of five stars on Google Maps.WATCH BELOW: Local Business owner among many targeted in Google reviews extortion scheme Florida business owner among many targeted in Google reviews extortion scheme ""As a business owner, you really try and do the right thing for customers,"" Larkin said.But earlier this month, his company received 14 one-star Google Maps reviews over just two days. One called the workers ""unprofessional, slow, and rude."" Another described it as the ""worst moving experience I've ever had."" A third claimed movers ""dragged furniture across the floor, causing scratches.""Before the incidents, Larkin's Moving had a 4.9 stars out of 5 for a Google review. After the apparent extortion attempts, it dropped to a 4.3.""A lot of people will look at our history on Google and other businesses that will make them determine whether they'll work with you or not, depending on your rating,"" Larkin said.Larkin knew the reviews were fake. Then he received a text message: ""I have received (an) order for 30 bad reviews,"" followed by an offer of ""$200 for this order if you pay me (to take them down).""An investigation revealed that the country code on the text originated from Pakistan.""It's hard to run a small business, particularly when Google allows these networks of scammers halfway around the world to ruin your online reputation,"" said Kay Dean, a former federal investigator and nationally known expert in online fraud.Dean investigated the Google Maps reviews of Larkin Moving and Delivery and compiled a spreadsheet of those posting the one-star ratings. Her research shows the same accounts posting bad reviews for Larkin also targeted a cleaning service in Central Florida, car dealers in New Jersey and businesses in Spain, the United Kingdom and New Zealand on Google. WPTV Kay Dean, a former federal investigator and nationally known expert in online fraud, speaks with investigative reporter Dave Bohman. Some of these businesses received similar texts demanding money to remove the posts or face more bad reviews, all coming from Pakistan.""There's this whole underworld of nefarious activities underpinning what the public actually sees on Google, and this includes just an ocean of fake positive reviews, fake negative reviews, and even extortion,"" Dean said.Just a day after speaking with Larkin, several scathing reviews of a spa in Orlando appeared online. The same names posting one-star ratings on Larkin Moving posted bad Google reviews for the Key Massage and Facial Spa in Orlando. The spa's owner tells WPTV that she was also offered the opportunity to have the reviews removed for $200.Dean said Google should be able to prevent most of these bogus reviews from being posted in the first place.""And it's insufficient from a billion-dollar tech company,"" Dean said.Google did not respond to multiple email requests for comment. The company's website reports: ""Last year, our AI-powered detection systems blocked or removed more than 12 million fake business profiles and over 240 million reviews.""Larkin never paid the $200 to have the bogus reviews removed. His business regained its 4.9-star average review after he was able to get Google to take down the fake reviews. But for four days, those negative reviews were online for potential customers to see.""If it had stayed on there long term, it would be very hurtful for the business. A lot of people rely on the reviews,"" Larkin said.For consumers looking to do business with a company and relying on Google Maps reviews, experts suggest watching for one red flag: If a business receives several bad reviews in a short period of time, chances are these reviews are fake.This story was reported on-air by a journalist and has been converted to this platform with the assistance of AI. Our editorial team verifies all reporting on all platforms for fairness and accuracy.","https://www.wptv.com/wptv-investigates/west-palm-beach-business-owner-among-many-targeted-in-google-reviews-extortion-scheme"
"Florida lawmaker proposes pool safety bill after Scripps News investigation","Scripps News Investigates Florida lawmaker proposes vacation rental pool safety bill after Scripps News investigation Bill would allow the state to suspend or revoke a license if the vacation rental is not in compliance. The bill would allow the state to suspend or revoke a license if the vacation rental is not in compliance. (Scripps News) By: Lori Jane Gliha , Brittany Freeman Posted and last updated A Florida lawmaker has proposed legislation to impose pool safety requirements on short-term rental properties after a Scripps News investigation revealed dozens of child drownings at vacation homes.State Sen. Carlos Guillermo Smith, a Democrat, introduced Senate Bill 608 last week.The bill would require those seeking a new short-term rental license or a license renewal to have at least one pool safety feature in place if the property has a pool. It would also authorize the state to suspend or revoke a license if the vacation rental is not in compliance.Options for the required safety feature include: an exit alarm on doors and windows leading to the pool, a safety pool cover, a swimming pool water alarm, a self-latching device on doors leading to the pool, and a barrier fence that surrounds a swimming pool.RELATED STORY | Scripps News investigation finds vacation home deaths involving childrenCurrently, the state residential pool safety law requiring at least one pool safety feature only applies to properties built after the year 2000, when the law was enacted. But Smith’s bill would expand those requirements to vacation rental properties seeking short-term rental licenses, regardless of when the property was built.Smith said this summer he planned to introduce the bill after seeing a series of Scripps News investigations focused on child drownings in backyard pools in vacation homes.“That was an issue that we knew was a problem, but we didn't realize the extent of the problem until we saw some of this reporting that has been put together by Scripps News,” Smith said in September.RELATED STORY | Airbnb adds safety feature to waterfront listings and homes with poolsIn its ongoing investigation, Scripps News has obtained records from fatal and non-fatal drowning incidents at vacation home rental pools in Florida involving at least 50 children since 2021.The vacation home bill is one of three bills proposed by Smith this month aimed at improving water safety. He also proposed a drowning prevention education bill, and reintroduced a proposal to require properties built before 2000 to adopt pool safety features when they are transferred or sold. That proposal failed in last year’s legislative session.If the vacation rental pool safety bill passes, it is written to take effect next July.The 2026 Florida legislative session is set to begin in January.","https://www.wptv.com/scripps-news-investigates/florida-lawmaker-proposes-vacation-rental-pool-safety-bill-after-scripps-news-investigation"
"These toys are expected to fly off the shelves this holiday season","MoneyConsumer The Toy Insider shares the latest trendy gifts for kids this holiday season ACHPF/Shutterstock.com Stock image of toys on display at a store. By: Ashley Glass Posted WEST PALM BEACH, Fla. — WPTV connected with The Toy Insider ahead of the holidays to get on what's at the top of kids' wishlists this year. These are the toys that will fly off the shelves this holiday season, according to The Toy Insider's experts, whom WPTV anchor Ashley Glass spoke with. ""When we are choosing the hottest toys, we look for those trendy play patterns, the characters kids are obsessed with, and when the toy does something we’ve never seen before,"" The Toy Insider Editor-In-Chief Marissa Silva said. ""I think if a toy makes a grown-up say 'Whoa,' it's definitely going to make a kid say that.""Some of the toys Silva and her team hand-picked as the hottest toys this season include: Air Toobz by Fat Brain Toys, MSRP: $159.95Air Toobz by Toobzsters by Fat Brain Toys, MSRP: $14.95Paw Patrol Marshall's Rapid Reload Fire Truck by Spin Master, MSRP: $64.79Slime Mart - Basket & Bag by Zuru, MSRP: $7.99 bag, $14.99 basketPOKEMON Trading Card Game, MSRP: $49.99 Silva pointed out to Glass that it's essential to pay attention to the MSRP, as advised by The Toy Insider, so you don't overpay in-store or online for these hot holiday toys.","https://www.wptv.com/news/palm-beach-county/the-toy-insider-shares-the-latest-trendy-gifts-for-kids-this-holiday-season"
"How these moms are supporting our military year-round","CommunityLet's Hear It Military moms focused on supporting our soldiers, veterans and families Treasure Coast Blue Star Mothers on a mission to serve Treasure Coast Blue Star Mothers Treasure Coast Blue Star Mothers By: Ashley Glass Posted and last updated JENSEN BEACH, Fla. — Treasure Coast Blue Star Mothers are on a mission to support the brave men and women who serve our military.A representative from the group recently told WPTV morning anchor Ashley Glass all about it at a recent Let's Hear It community meet-up in Jensen Beach. WATCH: Military moms focused on supporting our soldiers, veterans and families Carrie Beck, a Blue Star mother, explained that one of their goals is to give our military a slice of home while they are deployed. Treasure Coast Blue Star Mothers recently wrapped up a supply drive and shipped out many care packages, but Beck said it's an effort they continue all year. ""If you can just know someone cares and you can get something, maybe you can just smile for a little bit that day,"" Beck said. Beck told Glass the best way for the community to get involved with gathering supplies for future care packages is to pick up an item from the nonprofit's wish list.","https://www.wptv.com/community/lets-hear-it/military-moms-focused-on-supporting-our-soldiers-veterans-and-families"