"Park rangers could soon patrol these parks as city approves $500K safety program","NewsPalm Beach CountyRegion C Palm Beach CountyLake Worth Beach Park rangers could soon patrol Lake Worth Beach parks as city approves $500K safety program WPTV's Vannia Joseph speaks to residents and city leaders about the plan that would create a new Park Ranger Division within the city's Leisure Services Department WPTV By: Vannia Joseph Posted and last updated LAKE WORTH BEACH, Fla. — Park rangers could soon be a regular sight at some of Lake Worth Beach's most popular public spaces.City leaders just approved a $500,000 Park Ranger Program aimed at keeping local parks clean, safe, and family-friendly. The plan, approved at Tuesday night's city commission meeting, would create a new Park Ranger Division within the city's Leisure Services Department.WATCH BELOW: 'We really want to embed them with the community,' Leisure Services Director Stuart Sword Park rangers could soon patrol these parks as city approves $500K safety program At Bryant Park, a father and son duo were having lunch at a bench when they learned about the city's latest move.""Quite frankly, I think the park seems pretty safe right now,"" said parkgoer Chase Patterson.While Patterson said he generally feels comfortable at the city's parks, leaders said the new initiative is meant to further enhance that sense of safety for families and visitors who frequent the city's green spaces.""$500,000 is a lot of money for the city of Lake Worth,"" said Elam Patterson.Of that half-million dollars, about $352,146 will go toward wages and benefits, and another $66,000 for other expenses including mountain bikes, uniforms, certifications, and marketing materials. That leaves more than $80,000 in reserve as the city evaluates the program's first phase. Lake Worth Beach City spending nearly $100K on upgrades to public park restrooms Vannia Joseph Stuart Sword, the city's director of Leisure Services, said the idea has been months in the making. He describes it as a ""cold start program"" — the first of its kind for Lake Worth Beach.""So, the park rangers will initially be at the beachfront, in Bryant Park, in Sunset Ridge, and Howard Park,"" Sword said. ""Those parks are cumulatively about 30 acres of green space."" Sword said those four parks will act as a focus group to gauge the success of the program before expanding to others.""Their footprint is not just limited to those four parks, they could go to the other 32 open green spaces throughout Lake Worth Beach,"" said Sword.While Palm Beach County Sheriff's Office deputies will continue overnight patrols under the city's $15 million contract, the park rangers' duties will differ.WATCH: Mayor proposed making people pay to use park bathrooms Lake Worth Beach to tackle vandalism at public park restrooms ""A park ranger is not a law enforcement officer. They are not certified under the criminal system, so when they approach a citizen and they're not in line with a city ordinance, they will issue a warning,"" Sword explained. ""They will have the ability to issue citations if the situation warrants that citation being issued, they will not have arresting authorities but they will go through F.A.C.E training, that stands for Florida Association of Code Enforcement, once they go through that training, they will be they will be certified to enforce city ordinances. A lot of those city ordinances do pertain to our parks, beach front, and our recreation facilities."" City commissioners said the move comes after complaints from residents who said they've felt unsafe in certain areas, particularly Bryant Park, where issues with homelessness and vandalism have been ongoing. Months earlier, WPTV reported that the city spent nearly $100,000 on restroom upgrades to prevent repeated damage. Those improvements included concrete sinks, sturdier dividers, and tile that's harder to damage and easier to clean.Sword said the Park Ranger program will roll out in phases beginning with recruitment, training, and community outreach before rangers hit the parks. The program would start with one manager, three full-time rangers, and two part-time rangers, they'd focus on education, enforcement, and community outreach, using bike patrols to stay visible and approachable.""Ideally, in the next 120 days, you will see a uniformed park ranger in one of the four parks I mentioned,"" Sword said. ""We really want to embed them with the community, we're excited to kick this off."" Sign up for our Morning E-mail Newsletter to receive the latest headlines in your inbox. window.addEventListener('message', });","https://www.wptv.com/region-c-palm-beach-county/lake-worth-beach/park-rangers-could-soon-patrol-lake-worth-beach-parks-as-city-approves-500k-safety-program"
"Why this town is amending its parks rules after 30 years","NewsPalm Beach CountyRegion N Palm Beach CountyJupiter How the Town of Jupiter is making its parks safer when it comes to e-bikes WPTV's Jon Shainman is digging into how the town is trying to create safer parks by adding new rules on e-bikes, among other things WPTV By: Jon Shainman Posted and last updated JUPITER, Fla. — We’ve been listening to your concerns over e-bikes, and Tuesday we reported about a proposed bill in Tallahassee that would create new license requirements for them.WATCH BELOW: 'We don’t want them to be tearing up the fields,' Mayor Jim Kuretsk tells WPTV Town of Jupiter making parks safer when it comes to e-bikes Now one town is trying to create safer parks by adding new rules on e-bikes, among other things.On a Wednesday morning, there were bats, balls and bikes all over Jupiter Community Park. But members of the Jupiter Senior Softball League tell me they don't see e-bikes when they're playing. But Rick Tuyn said when he watches his grandson play ball out of state, he sees them everywhere.""They go around the perimeter of the ballfields the entire time, and someone is going to get hurt,"" said Tuyn.Thursday, the Jupiter Town Council will be looking at updating its parks rules for the first time in more than 30 years.“Our parks and rec and police got together and did a real scrub of our code,"" said Jupiter Mayor Jim Kuretski.WATCH: Proposed e-bike legislation would put more safeguards in place Proposed legislation would crack down on motorized bikes in Florida Kuretski tells me one part of the ordinance would require e-bikes, scooters, motorcycles, and even regular bikes to stay only on the roads in town parks.“We don’t want them to be tearing up the fields. We’ve spent a lot of money on our athletic fields and it’s important to maintain them in good condition.,"" said the mayor.The town was touched by tragedy back in March when a 12-year-old was killed in an e-bike accident. That has led to community meetings with police about their safe operation.Other proposed park rules include banning drones, alcohol without a permit, and fireworks.The town is investing millions of dollars in revamping all of its parks, and residents say anything that can be done to keep them safer is a good idea.Read more of WPTV's related coverage below: Palm Beach County Proposed legislation would crack down on motorized bikes in Florida Kayla McDermott Jupiter Jupiter hosts first-ever e-bike safety festival to promote community awareness Emma Romano Jupiter 'It’s not a toy': Mother stresses e-bike safety after son's accident Cassandra Garcia Sign up for our Morning E-mail Newsletter to receive the latest headlines in your inbox. window.addEventListener('message', });","https://www.wptv.com/news/region-n-palm-beach-county/jupiter/how-the-town-of-jupiter-is-making-its-parks-safer-when-it-comes-to-e-bikes"
"Trump lands in Miami to speak about his economic agenda","NewsTrump Trump lands in Miami to speak about his economic agenda on the anniversary of his election win Patrick Semansky/AP FILE - In this Dec. 12, 2020, file photo President Donald Trump walks on the South Lawn of the White House in Washington before boarding Marine One. Unemployment benefits for millions of Americans struggling to make ends meet were set to lapse at midnight Saturday night unless Trump signed an end-of-year COVID relief and spending bill that had been considered a done deal before his sudden objections. (AP Photo/Patrick Semansky) By: Seung Min Kim, Associated Press Posted MIAMI — President Donald Trump is in Miami on Wednesday — the anniversary of his reelection to a second term — to speak to a forum of business leaders and global athletes about what he sees as his economic achievements.He began his remarks by proclaiming his love for the city of Miami and bragging about his electoral success one year ago, as well as the state of the economy.""We have the greatest economy right now. A lot of people don't see that,"" Trump said.The Republican president's speech to the America Business Forum will be a broad look at his economic agenda and how investments he has secured abroad help U.S. communities, according to a senior White House official. It's a significant effort from Trump to put a positive spin on the economy at a time when Americans remain uneasy about the state of their finances and the cost of living — and when major campaigns in Tuesday's elections were centered on affordability and the economy.The AP Voter Poll survey, which included more than 17,000 voters in New Jersey, Virginia, California and New York City, suggested the public was troubled by higher prices and fewer job opportunities despite Trump's promises to tame inflation and unleash growth. Republicans handily lost key races in Virginia and New Jersey, and the president acknowledged Wednesday that the ongoing government shutdown, whose effects have rippled throughout the economy and forced government workers to go without paychecks, was ""negative for the Republicans.""In his speech, Trump will touch on deregulation, energy independence and oil prices, and affordability, said the White House official, who insisted on anonymity to preview the president's address.Trump spent five days in Asia last week with stops in Malaysia, Japan and South Korea. He worked to ease trade tensions with Beijing in a meeting with Chinese leader Xi Jinping. In Tokyo, he promoted several major energy and tech projects for the U.S. that will be funded by Japan.Miami Mayor Francis Suarez said he thinks Trump's recent travels ""have been transformational in his presidency"" and said his speech will be a highlight of the forum, which organizers have described as a more accessible version of the World Economic Forum in Davos, Switzerland, or the Milken Institute Global Conference, which gathers the world's elite for discussions on the economy.Political leaders, business executives and athletes including tennis legend Serena Williams and soccer star Lionel Messi are among the speakers at the forum inside Kaseya Center, the home of the Miami Heat that been has transformed with an elaborate, futuristic stage where speakers are introduced with a light display and machines shooting smoke into the air. It's primarily sponsored by Saudi Arabia's sovereign wealth fund, known as the Public Investment Fund, which is a key pillar of Crown Prince Mohammed bin Salman's plans to pursue megaprojects and investments abroad.""This conference not only is creating this incredible collection of people, but it's also creating them in a particular moment in time,"" said Suarez, a Republican.Earlier Wednesday, the conference hosted María Corina Machado, the Venezuelan opposition leader and winner of this year's Nobel Peace Prize who praised the U.S. president's posture toward Venezuela in her remarks.""Regarding the strategy of President Trump toward this criminal narco-terrorist structure, it's absolutely correct because Nicolás Maduro is not a legitimate head of state,"" said Machado, who appeared at the forum remotely.Trump's visit also highlights how the Miami area is playing a key role during his second term.Trump is set to host leaders of the world's leading rich and developing economies at next year's Group of 20 summit at his golf club at the nearby city of Doral, despite what critics say is the appearance of impropriety.Trump's sons have taken over running the Trump Organization while their father is in the White House, and the president has insisted that his family's business will not make any money by holding the summit at the golf club.The city is where Trump wants to locate his future presidential library, which is now facing a legal challenge over whether the plot of land in downtown Miami is being properly transferred. Miami is also one of the U.S. host cities for next year's World Cup, which Trump has eagerly promoted as the kickoff to several major global sporting events for which the U.S. is playing host. Ensuring the success of the World Cup has been a top priority for the Trump administration.FIFA President Gianni Infantino, with whom Trump has developed a close friendship, is scheduled to speak at the Miami forum later Wednesday. Sign up for our Morning E-mail Newsletter to receive the latest headlines in your inbox. window.addEventListener('message', });","https://www.wptv.com/news/trump/trump-lands-in-miami-to-speak-about-his-economic-agenda-on-the-anniversary-of-his-election-win"
"Argument about chickens leads to 3 arrests after shots fired outside pub","NewsTreasure CoastRegion St Lucie CountyPort St Lucie Shots fired, alleged violence against officers in parking lot of Port St. Lucie pub leads to 3 arrests Gunman apparently 'became paranoid and agitated' after he was accused of trying to be conned, police say Port St. Lucie Police Department Peter Riera was taken into custody by Port St. Lucie on Nov. 4, 2025, outside Harpers Pub. By: Scott Sutton , Tyler Hatfield Posted and last updated PORT ST. LUCIE, Fla. — Three people were arrested after multiple shots were fired early Tuesday morning in a Port St. Lucie parking lot, police said. The incident happened at about 2:48 a.m. in the parking lot of Harpers Pub, located at 1774 Southeast Port St. Lucie Blvd.WATCH BELOW: Argument about chickens leads to 3 arrests after shots fired outside pub Shooting outside Port St. Lucie pub stemmed from chickens & eggs, police Police said a preliminary investigation revealed that a disturbance occurred in the parking lot after the pub closed. During the disturbance, police said Peter Riera, 44, of Port St. Lucie, brandished a Glock 30 handgun and fired four shots at three different victims — 2 men and one woman in their 20s — as they ran through the parking lot. No one was struck by the gunfire. Investigators said the three victims knew each other and had just met Riera that night. According to the police, they were all drinking together inside the pub and were all intoxicated to varying degrees. They tell us Riera and the three victims then got into an argument over chickens. ""There was a conversation about how many, I kid you not, how many eggs a chicken can lay. And that conversation got a little heated, and as it went out into the parking lot, the conversation continued, and the shooter became agitated, became paranoid,"" said Sgt. Dominick Mesiti. Once they were all outside the pub, police said Riera apparently ""became paranoid and agitated"" as he accused the victims of trying to ""con"" him. But investigators spoke with witnesses who say that claim was unsubstantiated. These allegations escalated the disturbance, resulting in Riera firing his handgun. Surveillance video shows Riera hiding after police say he fired at the three victims. Police announced Wednesday that Riera now faces the following charges: 3 counts of attempted aggravated battery with a deadly weapon2 counts of aggravated assault with a deadly weapon 4 counts of discharging a firearm in public 1 count of use of a firearm while under the influenceDuring the investigation, police said Brandon Pace, 24, of Port St. Lucie, was detained at the scene and arrested after police said he obstructed officers during the investigation and kicked two officers while being detained. Pace faces one count of resisting an officer with violence and two counts of battery on a law enforcement officer after police said he kicked two different officers while being detained.Kayla Damiani, 26, of Port St. Lucie, was also arrested by officers and faces one count of resisting an officer without violence. Police said she obstructed officers during their investigation while they tried to detain Pace. Investigators said Damiani ran toward Pace and officers after being lawfully ordered to stay back.The handgun fired during the incident, along with four shell casings, was recovered at the scene.Riera is being held at the St. Lucie County Jail with no bond.Pace is being held at the St. Lucie County Jail with no bond.Damiani was released from the St. Lucie County Jail on a $500 bond.Anyone who may have witnessed the incident or may have video is urged to call Detective Samantha DiPierro at (772) 871-5001 or Treasure Coast Crimestoppers at (800) 273-8477. Sign up for our Morning E-mail Newsletter to receive the latest headlines in your inbox. window.addEventListener('message', });","https://www.wptv.com/news/treasure-coast/region-st-lucie-county/port-st-lucie/shots-fired-alleged-violence-against-officers-in-parking-lot-of-port-st-lucie-pub-leads-to-3-arrests"
"Fintech firm that boasted it would bring 200 new jobs is shutting down","NewsPalm Beach CountyRegion C Palm Beach CountyWest Palm Beach Fintech firm MyBambu shutting down West Palm Beach office, laying off all employees The company sent WPTV a written statement calling the letter 'precautionary’ because it’s working on raising money to keep the office open WPTV By: Ethan Stein , Audra Schroeder Posted and last updated WEST PALM BEACH, Fla. — A West Palm Beach fintech firm that boasted it would bring 200 new jobs to the area is already shutting down operations. MyBambu, a financial services company that moved its base of operations from Memphis to West Palm Beach in 2021, moved into a new 35,000-square-foot office space on Dixie Highway over the summer — marking one of the largest leases in the city of West Palm Beach. WPTV was at that July event featuring city and county leaders, when CEO Douglas Quay remarked, ""We are getting ready to grow significantly."" WATCH: MyBambu closing West Palm Beach office Fintech firm that boasted it would bring 200 new jobs is shutting down Just three months later, the company is laying off all 141 employees and ceasing operations by the end of December, according to a Worker Adjustment and Retraining Notification Act (WARN) notice sent to the Florida Department of Commerce. The company states in the notice that this decision was made ""after unexpectedly learning that the main and historical source of funding for MyBambu's operations would end, depriving MyBambu of funding necessary for running its operations and necessitating the commencement of an orderly wind-down."" A spokesperson for the company declined to answer WPTV’s questions about the letter. However, MyBambu sent us a written statement calling the letter “precautionary"" because it’s working on raising money to keep the office open.Multiple employees, who talked to WPTV off camera, said they are nervous and frustrated about the closure after recently changing offices. The letter said the first wave of layoffs, 100 employees, was expected on Oct. 31. The other 41 employees would likely lose their jobs by Dec. 31. PREVIOUS COVERAGE: MyBambu expands in Palm Beach County Fintech firm MyBambu expands in West Palm Beach, eyes 200 new jobs MyBambu boasted a range of services, from money transfers and banking to food delivery. In July, the Business Development Board of Palm Beach County said the company planned to add about 200 employees, bringing the total amount of employees to around 350 people. Photos show MyBambu worked with the city of West Palm Beach and the Business Development Board of Palm Beach County, a nonprofit using public money to attract businesses to the area. However, both organizations said they didn’t give the company any incentives. Previously, both used the company as an example of the area's economic growth in press releases.A spokesperson for the city of West Palm Beach said the news about the company was “unfortunate to hear” and noted they have no responsibility to keep private businesses successful.“The city is not responsible for the financial performance or operational success of private companies,” said Kat Joy, West Palm Beach spokesperson.Kelly Smallridge, president and CEO of the Business Development Board of Palm Beach County, said the group wasn’t aware of the organization's struggles. She also said she was confident employees laid off would find new jobs because of the area’s unemployment rate. READ THE NOTICE: Sign up for our Morning E-mail Newsletter to receive the latest headlines in your inbox. window.addEventListener('message', });","https://www.wptv.com/news/region-c-palm-beach-county/west-palm-beach/fintech-firm-mybambu-shutting-down-west-palm-beach-office-laying-off-all-employees"
"Doctor heads to Jamaica to help Melissa victims","NewsPalm Beach CountyRegion S Palm Beach CountyBoynton Beach Boynton Beach doctor heads to Jamaica to help victims of Hurricane Melissa Dr. Williamson and her team plan to travel to rural areas of Jamaica to provide medical assessments, first aid, and antibiotics WPTV Dr. Joan Williamson founded Living Well Community Care in 2020. By: Zitlali Solache Posted and last updated BOYNTON BEACH, Fla. — A Boynton Beach nonprofit is stepping up to help those devastated by Hurricane Melissa, traveling all the way to Jamaica to provide medical care and support.Living Well Community Care, founded by Dr. Joan Williamson, is a faith-based organization dedicated to serving communities in crisis. Dr. Williamson, a local family nurse practitioner who was born and raised in Jamaica, said her own experiences living through destructive hurricanes in the 1980s inspired her to create the nonprofit.WATCH WPTV'S COVERAGE BELOW: Boynton Beach doctor heads to Jamaica to help victims of hurricane Melissa “When you have experienced poverty of your own, and now you see others going through the same thing, you put yourself in their position,” said Williamson. “And for this reason, I have always had this desire to always go back.”Last year, her team of doctors, nurses, and medical professionals traveled to assist more than 600 patients after Hurricane Beryl. This time, the impact of Hurricane Melissa has reignited that mission.“My entire family lives there. Many of them have lost their roofs, they have lost their houses,” said Williamson. “They have still can’t find some of my family members, so this is now more personal for me.”Williamson and her team plan to travel to rural areas of Jamaica to provide medical assessments, first aid, and antibiotics while also working to prevent chronic diseases through early intervention.“I’ve just seen extreme devastation. Extreme,’ said Williamson. “Bodies still can’t be found. There’s stench because there are still bodies underneath. The rescue teams-they are doing a great job. But nowhere to live. The houses are damaged. Cuts and bruises and infections.”WPTV reporter Zitlali Solache also spoke with Veroll Smith, a resident of Jamaica, who described the fear of living through the storm.“It was one of the most terrifying experiences,’ said Smith. “In Jamaica, we have a style where we say everything is alright, man, everything will be alright, but everything is not alright. I can tell you that. We are not good, we need the help.”Williamson hopes her organization’s work will bring relief to families like Smith’s. Fifty medical professionals with Living Well Community Care will be on the ground in Jamaica from Nov. 21 through Dec. 6.“I want people to live well and that’s our ultimate goal,” said Williamson. Sign up for our Morning E-mail Newsletter to receive the latest headlines in your inbox. window.addEventListener('message', });","https://www.wptv.com/news/region-s-palm-beach-county/boynton-beach/boynton-beach-doctor-heads-to-jamaica-to-help-victims-of-hurricane-melissa"
