"Coach arrested for sending inappropriate texts to 16-year-old girl","NewsPalm Beach County Lake Shore Middle School basketball coach arrested for inappropriate texts to 16-year-old girl Javian Dennard Golphin, Jr., 25, of Belle Glade faces numerous charges, including soliciting a child for unlawful sexual conduct using computer/device and transmission of material harmful to minor WPTV File photo of a Palm Beach County Sheriff's Office cruiser. By: Aja Dorsainvil Posted PALM BEACH COUNTY, Fla. — A Palm Beach County School District employee was arrested by the Palm Beach County Sheriff’s Office after, deputies say, he sent sexually explicit images and videos via text message to a 16-year-old girl.Lake Shore Middle School basketball coach Javian Dennard Golphin, Jr., 25, of Belle Glade was arrested on Wednesday and released on Thursday just after 1 p.m.PBSO deputies said Golphin knowingly texted the 16-year-old girl sexually explicit images and videos after meeting the girl at her job.According to a probable cause affidavit, Golphin sent the girl videos of himself masturbating on numerous occasions from Sept. 9 to Oct. 20 and asked the girl what was the oldest person she's talked to.Golphin faces numerous charges, including soliciting a child for unlawful sexual conduct using computer/device, transmission of material harmful to minor, and unlawful use of a two-way communication device.Below is the message the school district sent to parents on Thursday: Good afternoon, Lake Shore Middle School families and staff,I am writing to inform you that a non-instructional staff member at our school, Javian Golphin, was arrested by the Palm Beach County Sheriff’s Office in collaboration with School Police. He was arrested on the following charges: soliciting a child for unlawful sexual conduct using computer/device, transmission of material harmful to minor, and unlawful use of a two-way communication device.The School District holds all employees to the highest standards of conduct and is committed to a safe learning environment for all students. We expect every staff member to meet the professional and ethical standards necessary to support the safety of students. Following a complaint, Mr. Golphin was removed from the school on October 7, 2025 and placed under investigation.Mr. Golphin will not be returning to our campus. Please understand that because this is an open investigation, we are unable to provide further details at this time.The safety and well-being of our students remain our highest priority. We continue to encourage students to report any suspicious or concerning activity to a trusted adult or through the FortifyFL [getfortifyfl.com] app. If you or your student have any relevant information regarding Mr. Golphin, please contact School Police at: (561) 434-8700, attn: Lt. Wagner.Sincerely,Dr. Carl GibbonsPrincipalLake Shore Middle School Sign up for our Morning E-mail Newsletter to receive the latest headlines in your inbox. window.addEventListener('message', });","https://www.wptv.com/news/palm-beach-county/lake-shore-middle-school-basketball-coach-arrested-for-inappropriate-texts-to-16-year-old-girl"
"Woman faces eviction amid 5-month unemployment benefit delay","NewsLocal NewsWPTV Investigates Port St. Lucie woman waits months for unemployment decision as eviction looms 'I'm going to end up on the street,' Lena Hoti says WPTV Lena Hoti By: Jamie Ostroff Posted and last updated PORT ST. LUCIE, Fla. — A Port St. Lucie woman faces homelessness after waiting five months for Florida's Department of Commerce to determine her eligibility for unemployment benefits, highlighting ongoing systemic issues with the state's re-employment assistance program.Lena Hoti was laid off from her hotel housekeeping job about five months ago and applied for Florida's re-employment benefits in June. Despite weekly visits to her local CareerSource center in Fort Pierce, where staff connect her directly to the Florida Department of Commerce, she still hasn't received a decision on her claim.WATCH BELOW: Woman faces eviction amid 5-month unemployment benefit delay St. Lucie Co. woman faces eviction amid 5-month unemployment benefit delay ""I've been waiting five months for them to decide whether I'm going to get these benefits or not,"" Hoti said. ""Nobody can really give me a straight answer. And it's kind of frustrating.""Florida's re-employment benefit is capped at $275 per week. For Hoti, who rents a bedroom from a family in a Port St. Lucie apartment, that money represents a crucial lifeline.""I need to pay my rent, and if I don't have this money, I'm going to end up on the street,"" Hoti said.She has about two weeks before she must vacate her current living situation.""I'm looking for shelters or anything, but there's really nothing in this area,"" Hoti said. National Politics Americans grow anxious about jobs and inflation under Trump, new poll shows AP via Scripps News Group Hoti said she no longer has a vehicle, after her car broke down and she couldn't afford to fix it. Friends have been driving her to CareerSource and local food banks for groceries, she said.Despite having what she describes as ""a pretty impressive resume"" from years of housekeeping work, Hoti hasn't received responses to her daily job applications. She noted that even during the pandemic, she found employment within four months.When visiting CareerSource weekly for updates on her claim status, Hoti receives the same response. National News New report finds majority of US workers lack a 'quality job' Holly Firfer ""Oh, that the claim is being reviewed and that we will have an answers hopefully soon,"" she said. ""It's the same excuse every week.""""I think it's awful that they that they keep people waiting like this for months,"" Hoti said.A spokeswoman for FloridaCommerce said they are looking into Hoti's case. The spokeswoman did not provide a timeline or answers to emailed questions about why a determination of eligibility could take so long.This situation contrasts with the Florida Department of Commerce's September employment data report, which stated: ""Data in the month of August continues to indicate that there are jobs available for every Floridian who wants to work.""This story was reported on-air by a journalist and has been converted to this platform with the assistance of AI. Our editorial team verifies all reporting on all platforms for fairness and accuracy.Read more of WPTV's coverage of the current job market below: Let's Hear It Breaking through the hiring freeze: Tips from career experts Matt Sczesny Consumer AI is screening job resumes: Use these tricks to beat the bots Matt Sczesny Let's Hear It Job market struggles: Expert tips that actually work Matt Sczesny Consumer 'I'll take anything': Why landing work feels harder than ever Matt Sczesny Sign up for our Morning E-mail Newsletter to receive the latest headlines in your inbox. window.addEventListener('message', });","https://www.wptv.com/wptv-investigates/port-st-lucie-woman-waits-months-for-unemployment-decision-as-eviction-looms"
"'Don't be ashamed': Free food for federal workers impacted by shutdown","NewsPalm Beach CountyRegion S Palm Beach CountyBoca Raton Boca Helping Hands is giving free food to federal workers amid shutdown Starting Thursday, Oct. 23, the organization is making free food available to the estimated 7,000 people impacted by the shutdown in our community WPTV By: Victor Jorges Posted BOCA RATON, Fla. — The leadership and volunteers at Boca Helping Hands are thinking about all the employees impacted by the ongoing government shutdown.Starting Thursday, Oct. 23, the organization is making free food available to the estimated 7,000 people impacted by the shutdown in our community. That’s an estimate from the U.S. Bureau of Labor Statistics and reflects federal government employment in the metropolitan division covering much of Palm Beach County in 2023.All you have to do is go to one of their five locations, they'll verify that you're currently being affected by the shutdown, and you'll receive about 30 pounds of food.""We're here for you, your neighbors want to help you,” said the organization's executive director, Andrew Hagen. ""Don't be ashamed. We know you work hard at your job, but it’s not your fault you’re not getting paid. We’re behind you, we’re hoping this will end soon, but until then, come on down.""The bag of food includes pantry staples, bread, frozen meat and produce.Hagen said one bag should feed a family of four for around three to four days, and feed one person for about a week.Boca Helping Hands1500 NW 1st CtBoca Raton, FL 33432CrossBridge Church10101 Judge Winikoff RdBoca Raton, FL 33428Bethel Evangelical Baptist Church5780 W Atlantic AveDelray Beach, FL 33484First Baptist Church of Boynton Beach301 N Seacrest BlvdBoynton Beach, FL 33435Proclaim Church (formerly Advent Lantana)2116 Lantana RdLake Worth, FL 33462For more information, contact Boca Helping Hands front desk at (561) 417-0913. Sign up for our Morning E-mail Newsletter to receive the latest headlines in your inbox. window.addEventListener('message', });","https://www.wptv.com/news/region-s-palm-beach-county/boca-raton/boca-helping-hands-is-giving-free-food-to-federal-workers-amid-shutdown"
"Driver accused of going 135 mph charged with DUI manslaughter","NewsPalm Beach CountyRegion S Palm Beach County Driver accused of going 135 mph on Military Trail in Palm Beach County charged with DUI manslaughter Dale Drotar faces multiple felony charges in 4-vehicle crash that killed 25-year-old woman WPTV Dale Drotar appears in a Palm Beach County courtroom on Oct. 23, 2025. By: Samantha Roesler Posted and last updated PALM BEACH COUNTY, Fla. — A Palm Beach County man is facing multiple felony charges in connection with a deadly four-vehicle crash that occurred near Boynton Beach earlier this year.According to arrest documents, Dale Drotar, 40, was driving his Corvette south on Military Trail at about 10 p.m. on April 6 when he crashed into a Toyota Camry driving north on Military Trail and attempting to turn left onto Cedar Point Boulevard.A passenger in the Camry, 25-year-old Natalie Pierre, died at the scene from her injuries.Investigators said Drotar showed signs of intoxication and was taken to the hospital after being pulled from his vehicle by a witness. Inside Drotar's car, deputies said they found a 200ml bottle of Jack Daniel's with a small amount of alcohol left inside.A toxicology report indicated Drotar's blood alcohol content was 0.126, above the legal limit of 0.08, and data collected from the crash said Drotar was driving around 130 mph in a 45 mph zone at the time of the collision.Drotar faces a count of vehicular homicide, DUI manslaughter, four counts of reckless driving and causing injuries and four counts of DUI causing injuries. He made his initial court appearance Thursday morning and is being held on a $540,000 bond.Drotar is scheduled to be back in court on Nov. 21 and Dec. 18. Sign up for our Morning E-mail Newsletter to receive the latest headlines in your inbox. window.addEventListener('message', });","https://www.wptv.com/news/palm-beach-county/man-accused-of-driving-135-mph-on-military-trail-charged-with-dui-manslaughter"
"Third poisoning case emerges against Okeechobee babysitter","NewsTreasure CoastRegion Okeechobee County Investigators uncover third case involving Okeechobee babysitter accused of poisoning children New documents show 2023 investigation into possible opioid poisoning of 2-month-old in Anna Adamo's care Okeechobee Police Department By: Michael Hoffman Posted OKEECHOBEE, Fla. — Tonight, we’re learning that investigators in Okeechobee County are revisiting yet another case involving Okeechobee babysitter Anna Adomo.A second case from nearly a decade ago involved another baby in her care who was found with anti-freeze poisoning. That case from 2014 had nearly identical accusations but was dropped because of a lack of evidence.WATCH WPTV'S COVERAGE BELOW: Investigators uncover third case involving Okeechobee babysitter accused of poisoning children WPTV's Michael Hoffman has been following this case since her arrest, even confronting the suspect as she bonded out of jail.WPTV's Michael Hoffman has uncovered new documents that show a third investigation into the possible poisoning of a baby in the care of Adamo. The incident report from 2023 shows a healthy 2-month-old was picked up from Adamo's Okeechobee home after a day of babysitting. Parents took the baby to a friend's house before going home.They noticed abnormal breathing at the friend’s house, worsening when they got home. Documents showing that the 2-month-old “was a bit lethargic and not acting his normal self.""Parents then noticed it was “as if the baby could not wake up.”They rushed him to the hospital, where staff found “the baby tested positive for opioids” and was airlifted to another hospital. After 2 doses of Narcan, the infant “has made a full recovery.”The investigation brought detectives to test the parents' bottles and formula for opioids, which all came back negative.At the friend’s house, “CSI took many samples and none showed trace amounts of opiates.”When they went to Adamo’s home — investigators “found the house to be very clean,” but documents show “No evidence was collected at the [Adamo’s] residence.”According to documents, investigators “could not discover where the source of the opiate originated from or how the child came into contact with it.”The case was then closed.Hoffman asked the sheriff’s office why Adamo’s house wasn’t tested in 2023, to which they responded the following:“Given recent events in the current [2025] case, the agency has initiated a review of all past cases involving Adamo. Updates will be provided if and when any new information regarding those cases becomes available.”Even with this latest case, investigators say there is a possibility for more investigations to come to light. This is an ongoing investigation. Stay with WPTV for updates. Sign up for our Morning E-mail Newsletter to receive the latest headlines in your inbox. window.addEventListener('message', });","https://www.wptv.com/news/treasure-coast/region-okeechobee-county/investigators-uncover-third-case-involving-okeechobee-babysitter-accused-of-poisoning-children"
"Palm Beach approves larger Mar-a-Lago helipad, neighbors raise concerns","NewsPalm Beach CountyRegion C Palm Beach CountyPalm Beach Palm Beach approves larger Mar-a-Lago helipad, neighbors raise concerns Residents near Mar-a-Lago say it’s one more change they’ll have to live with ( ) (AP Photo/Steve Helber) This is an aerial view of President Donald Trump's Mar-a-Lago estate, Tuesday, Aug. 10, 2022, in Palm Beach, Fla. By: Zitlali Solache Posted and last updated PALM BEACH, Fla. — A new and larger helipad is coming to President Donald Trump's Mar-a-Lago Club.On Wednesday, the town's Land Preservation Commission voted to approve the Marine One helipad, walkway and light fixtures.We first told you about the landing pad earlier this month. It will measure 60 feet in diameter and will sit on the west lawn, the same location as Trump's first term in office.WATCH WPTV'S COVERAGE BELOW: Palm Beach approves larger Mar-a-Lago helipad, neighbors raise concerns ""Will it make noise? Absolutely. These are very big helicopters, and they do make noise,"" said land use attorney Harvey Oyer III. ""They're very heavy, which is why we don’t want to land it on the grass.""Oyer said it will be used for security evacuation rather than daily travel and will be built to support Marine One's weight.During the meeting, member Alexander Ives raised concerns about allowing temporary structures in the town, voting against the request. WPTV has listened to people with concerns about noise, which is nothing new for longtime resident Dave Kaminer.""We have constant helicopters flying up and down the coast,"" said Kaminer.Kaminer, already hearing helicopters at midnight, hopes this won’t add to the noise.""We would hope that Mr. Trump or anybody else using that helicopter is not going to be out here at 2 a.m. waking people from their sleep and that they'll be using it for the benefit of our country,"" said Kaminer.Now, Mar-a-Lago representatives will apply for a building permit.Mar-a-Lago will pay for the helipad, and it will be removed at the end of Trump's presidency. Sign up for our Morning E-mail Newsletter to receive the latest headlines in your inbox. window.addEventListener('message', });","https://www.wptv.com/news/region-c-palm-beach-county/palm-beach/palm-beach-approves-larger-mar-a-lago-helipad-neighbors-raise-concerns"