"Delray Beach set to begin $19M shoreline rebuild project","NewsPalm Beach CountyRegion S Palm Beach CountyDelray Beach Delray Beach set to begin $19 million shoreline rebuild project WPTV reporter Zitlali Solache speaks with commissioner Juli Casale about why the work is necessary WPTV Approximately 325,000 cubic yards of sand will be added to eroded areas from rising sea levels. By: Zitlali Solache Posted and last updated DELRAY BEACH, Fla. — Residents are weighing in as the city of Delray Beach is preparing to launch a multi-million dollar project to rebuild its eroding shoreline.City officials say the beach renourishment effort is set to begin this winter, costing an estimated $19.2 million.WATCH BELOW: Delray Beach set to begin $19M shoreline rebuild project Delray Beach set to begin $19M shoreline rebuild project Commissioner Juli Casale said it will add 325,000 cubic yards of sand to eroded areas from rising sea levels.""Over time with storms, and what have you, the beaches wash away and you have less beach than what you should have or what you normally have,"" said Casale.The last nourishment project was completed in 2020. According to city leaders, it will be funded by the federal government, the Florida Department of Environmental Protection, Palm Beach County and the City of Delray Beach.""It's costly and you know, we don’t expend this kind of money unless it’s necessary,"" said Casale.City leaders said beach access will remain open throughout the project, although some areas in the south end may see temporary impacts.WPTV reporter Zitlali Solache spoke with beachgoers as the project comes with concerns about its environmental impact, cost and timing.""We read about adding more sand. We didn’t understand why because there’s enough sand here,” said Isak Cozen. ""Wouldn't you be better off doing it in June, July, August, September, when fewer people are here?""Since others cited concerns for coral reefs, Casale stated she is working on discussing long-term solutions to rebuild them on coastal nourishment projects.City leaders say the project is not only necessary for the shoreline but also important for tourism. The project is expected to be completed by early 2026.","https://www.wptv.com/news/region-s-palm-beach-county/delray-beach/delray-beach-set-to-begin-19m-shoreline-rebuild-project"
"'We're still here': Al’s Family Farms re-opens after tornado destruction","NewsTreasure CoastRegion St Lucie County 'We're still here': Al’s Family Farms re-opens after tornado destruction After rebuilding from Hurricane Milton tornado damage, the longtime Fort Pierce business welcomes customers back with a taller barn, fresh remodel and renewed community spirit. WPTV Al's Family Farms in Fort Pierce reopened one year after tornado damage caused by Hurricane Milton. By: Cassandra Garcia Posted FORT PIERCE, Fla. — A year after tornadoes spawned by Hurricane Milton tore through St. Lucie County, Al’s Family Farms has reopened its beloved citrus shop, marking a major milestone for the third-generation business and its loyal customers.The shop’s iconic red barn off Kings Highway was packed on Saturday with community members celebrating the return of a local staple many feared might not come back.WATCH: "" We're still here"" - Al's Family Farms reopens to the public one year after Hurricane Milton Al's Family Farms reopens in Fort Pierce one year after Hurricane Milton “Oh we were glad to see that,” said Fort Pierce resident Sandra Foster, who's been visiting Al's Family Farms for the last 12 years.Fresh paint, a taller barn and a remodeled store greeted visitors as they stepped back into one of the few remaining citrus farms in South Florida.“To see it now as it is I think it's just a relief for the community and everybody’s really just excited that we’re still here because they look at us as like a staple in the community,” said Matthew Schorner of Al’s Family Farms.Just over a year ago, the farm’s signature barn was left in disarray. Splintered wood, twisted metal and widespread structural damage littered the property after multiple tornadoes touched down in Fort Pierce. The destruction left a void in the community.“So this is like the last of the Mohegans as far as citrus goes because we actually have a store where you can come and buy your own citrus, get the citrus ice cream,” Schorner said. “We’re the last one that does all that and even makes fresh juice right here.”Instead of replacing everything lost, the Schorner family salvaged what they could, including pieces of the original barn. They embraced the recovery with the help of the community.“If it hadn’t been for folks like you and the community we wouldn’t have had the wind in our sails and we wouldn’t have had, certainly, the strength to do it,” said owner Jeff Schorner during the ribbon-cutting ceremony.Residents like Foster say the rebuild felt remarkably swift considering the scale of damage. “We just keep going by watching the progress, but they did do it pretty quick,” she said.Previous coverage: Al's Family Farms celebrates comeback from tornado damage Al’s Family Farms celebrates comeback from tornado damage Now restored, the barn stands as a symbol of resilience and the farm’s enduring 48-year legacy in St. Lucie County.“We’ve got a lot of ideas for things we can do to make this place even better because we’re planning on being here for a long time,” Matthew Schorner said.Al’s Family Farms is once again open to the public, welcoming back customers with citrus, fresh juice and traditions rooted deep in the community.Portions of this story were assisted by artificial intelligence tools and reviewed by a WPTV journalists to ensure accuracy, clarity, and adherence to editorial standards.","https://www.wptv.com/news/treasure-coast/region-st-lucie-county/were-still-here-als-family-farms-re-opens-after-tornado-destruction"
"FAU professor placed on leave for Charlie Kirk comments files federal lawsuit","NewsEducation FAU professor placed on leave for comments about Charlie Kirk assassination files federal lawsuit On Wednesday, Dr. Cole’s legal team filed an 18-page federal lawsuit against FAU and 6 top officials Caleb Holder/WPTV By: Michael Hoffman Posted and last updated It’s been eight weeks since three Florida Atlantic University professors were placed on paid administrative leave following social media posts about Charlie Kirk’s assassination. Now, one of those professors is suing the university, alleging violations of his First Amendment rights. WATCH: Lawsuit argues FAU's actions were 'retaliatory' FAU professor placed on leave for Charlie Kirk comments files federal lawsuit We were first to report when conservative-leaning professor Dr. Rebel Cole became the second FAU faculty member placed on leave. Cole, a tenured professor of finance, was removed from the classroom for posts on X related to Kirk’s death. He remains barred from teaching or entering campus until further notice.On Wednesday, Dr. Cole’s legal team filed an 18-page federal lawsuit against Florida Atlantic University and six top officials:University President Adam HasnerInterim Provost Russ IvyAssociate Provost Stephen EngleChair of the Dept. of Finance Anita PennathurDonald NeubaumChee OstinelliThe complaint demands a jury trial and seeks compensation for damages, legal fees, and additional relief.According to the lawsuit, FAU’s actions were “retaliatory,” targeting Cole because he “chose to confront people on social media who celebrated the murder of Turning Point USA founder Charlie Kirk.” Education FAU hired GOP-connected firm to investigate professors over Kirk comments Ethan Stein The posts at the center of the controversy show Cole responding to someone using a megaphone in what the lawsuit describes as a “celebration” of Kirk’s murder. Cole replied in part: “This is NOT free speech. It is inciting a riot... someone should shut his mouth."" When another user challenged him, Cole responded: “Be very afraid. We are going to hunt you down. We are going to identify you. Then we are going to make you radioactive to polite society. And we will make you both unemployed and unemployable.” Dr. Cole is one of three FAU professors placed on leave. While Cole’s posts defended Kirk, the other two professors’ posts came from the opposite side of the political spectrum. The lawsuit argues that FAU targeted Cole in part “to give Defendants a safe harbor to claim that they also acted against a professor with conservative views.” Education EXCLUSIVE: FAU professor placed on leave over Kirk posts speaks to WPTV Michael Hoffman Both Dr. Cole and FAU declined to comment, citing ongoing litigation.Dr. Karen Leader, the first professor placed on leave, told WPTV that although she disagrees with Cole’s comments, she commends him for fighting for First Amendment rights. Leader previously stated in an exclusive September interview that she is also considering legal action but has not yet decided whether to file.Dr. Cole is represented by Edward H. Trent’s law firm — the same firm handling other free speech cases funded by X CEO Elon Musk.READ FULL LAWSUIT: MORE COVERAGE: Boca Raton Experts weigh in on FAU professor placed on leave after Charlie Kirk post Michael Hoffman State Court weighs FWC firing over Charlie Kirk social media post Forrest Saunders Region Martin County 'THIS IS UNCONSTITUTIONAL': Teacher faces firing over Charlie Kirk comments Kate Hussey","https://www.wptv.com/news/education/fau-professor-placed-on-leave-for-comments-about-charlie-kirk-assassination-files-federal-lawsuit"
"'Answer to prayer for sure': SNAP benefits finally arrive for families","MoneyConsumer SNAP benefits finally arrive for struggling families after government shutdown WPTV's Joel Lopez speaks to residents who have finally received their benefits and the Treasure Coast Food Bank who has seen an increased demand for food WPTV By: Joel Lopez Posted and last updated After more than a month without SNAP benefits during the government shutdown, SNAP users tell WPTV they are finally seeing funds deposited into their accounts, bringing relief to those who have been struggling to put food on the table.WATCH BELOW: 'It means I'll finally be able to put some food in there, answer to prayer for sure,' Shawn Ohearon tells WPTV SNAP benefits finally arrive for struggling families after government shutdown Shawn Ohearon had been checking his SNAP account every day for two weeks before finally seeing funds deposited Friday morning.""I was like, 'Oh heck yeah' you know what I mean, I was just like smiling now anyway,"" Ohearon said. ""It felt like Christmas morning, it's kinda like when you come downstairs and you see the Christmas tree and you see presents under it. It means I'll finally be able to put some food in there, answer to prayer for sure.""WPTV first met Ohearon at a food drive in Riviera Beach on Monday where he showed a balance of $0 in his account.""It's been really tough, that's for sure. I have my refrigerator cleared out, and cleared out my reserves I had in the cupboards,"" Ohearon said. ""I was getting worried on what I was going to do.""He was able to get food at the food drive where he was surrounded by multiple people whose SNAP funds had run out. However, not everyone has received their benefits yet. Consumer Record number of seniors using SNAP in Palm Beach County Joel Lopez ""Yeah no there's some that still haven't,"" Ohearon said, when asked if all his friends on SNAP had received their benefits.His SNAP account indicates timing on deposits varies by state. Ohearon said he's now worried about how possible future government shutdowns may impact him moving forward, and is shifting his grocery purchases to non-perishable foods.The USDA said all payments should be sent to SNAP recipients by Monday.""As soon as President Trump signed the bill to reopen the government, money was flowing to States,"" USDA spokesperson said when WPTV searched for answers. ""USDA stands ready to provide technical assistance if States are struggling to get benefits to families."" Food banks see surge in demand The Treasure Coast Food Bank has seen a surge in demand with a 25% increase of people needing food since SNAP benefits were cut off.""We're really optimistic right now, we're really hopeful now that the government has reopened that people will very soon will access their benefits,"" said Jessica Gosa, chief development officer with the Treasure Coast Food Bank.Gosa described the situation as a relief after a difficult period. She said during the holidays they often see an increase in families turning to them for help.WATCH BELOW: Need food? This online map grids out free locations Need food? This online map grids out free locations ""It was really a difficult time before we entered this challenge, with the cost of living maintaining high, groceries prices being high, we really have had a lot of our neighbors already struggling and having financial hardship,"" Gosa said.With the holidays coming up and children out of school, she warned it's a perfect storm of challenges for meeting food needs.To help with the extra need, the food bank is ramping up meal and grocery distribution efforts like their bus they call Market Fresh on the Move. It's a grocery store on wheels that brings fresh produce to areas in need.""It's bringing the food right to the community, where there might be increased need, or maybe a transportation challenge, to get to a grocery store,"" said Gosa.For those still in need of food assistance, the Treasure Coast Food Bank will be hosting a mobile food pantry at Vero Beach High School starting at 8 a.m. Saturday.","https://www.wptv.com/money/consumer/snap-benefits-finally-arrive-for-struggling-families-after-government-shutdown"
"'Needed a miracle': Local nonprofit helps struggling family become homeowners","NewsTreasure CoastRegion Martin County Family Promise of Martin County helps family facing eviction become homeowners For one Martin County father, a sudden medical crisis pushed his family to the brink of homelessness — until a local nonprofit stepped in Family Promise of Martin County By: Meghan McRoberts Posted MARTIN COUNTY, Fla. — As the cost of living continues to surge across South Florida, many longtime residents are finding it harder than ever to stay afloat. For one Martin County father, a sudden medical crisis pushed his family to the brink of homelessness — until a local nonprofit stepped in. WATCH: Brooker says everything changed when his wife’s health took a turn Family Promise of Martin County helps family facing eviction become homeowners Now, he’s celebrating something he once thought was impossible: owning his first home.New homes are frequently being built across the Treasure Coast, but prices are outpacing what many families can afford.“I was paying $2,200 a month for a 3-bedroom, 2-bath crap duplex wood frame falling apart thing,” said John Brooker, who lives in Martin County with his wife and three children. Brooker says the family had always managed to get by. “We were getting by okay, but you know, my wife had worked 34 years for the same bank,” Brooker said. Everything changed when his wife’s health took a turn, and she ultimately lost her job. Overnight, the family went from two incomes to one. “We were renters and rents were going up. It snowballed and next thing you know we’re upside down $12,000-$15,000 in credit card debt in just like six months,” Brooker said.Then came the eviction notice. “To be a father, and have three kids in your house and you’re trying not to tell them how bad things are knowing you’re going to be evicted any day,” Brooker said.Brooker sought help with food and bills but couldn’t find enough support to catch up.“I needed something. I needed a miracle. That’s what I got,” Brooker said.That “miracle,” he says, came from Family Promise of Martin County.“She was like, 'Yes we can help you'. I almost fainted.,” Brooker said.The nonprofit specializes in keeping families together during housing crises — something Executive Director Madeleine Bozone says sets them apart.“Our promise in family promise is keeping the family together. So in certain shelters they won’t take a parent if they have a child that’s a male age 12 or older... We’ll take the whole family and keep them together.”The organization provided the family with temporary housing at a very low rate, giving them a chance to stabilize and start saving again.In just nine months, Brooker was back on his feet — and for the first time in his life, a homeowner.“Now I have my own home that I only pay $1,400 a month for.”When asked what that moment felt like:“Is this your first time owning a home? asked WPTV. ""Yes. Amazing, amazing. Yea. How does it feel? Liberating,"" Brooker said. He says every day still feels surreal.“I pull in the driveway and I walk up to the house and I smile because this is mine. I did it. This belongs to me.”Bozone says Brooker’s story is one of success, but the demand for help continues to grow as rent prices keep rising faster than local wages.“There are families that really are, they’re just struggling and they can’t figure out why is it that I’m working full time, working another part-time job, or they do have two household incomes with two wage earners and still aren’t able to make it. It’s something we really have to solve in Martin County. It’s a problem for sure,” Bozone said. HOW TO HELPFamily Promise of Martin County relies heavily on community donations. This weekend, the organization is hosting its annual fundraiser — the Martin County Bed Races in downtown Stuart — where teams decorate twin beds and race them down Flagler Avenue. Attendees can cheer on the racers and make donations to support families facing homelessness.The event is Nov. 15 at 600 SE Flagler Avenue in Stuart, near Sailfish Ballpark, beginning at 10 a.m. More information here.","https://www.wptv.com/news/treasure-coast/region-martin-county/family-promise-of-martin-county-helps-family-facing-eviction-become-homeowners"
"Legislator renews calls to abolish HOAs following deadly dispute","NewsLocal NewsWPTV Investigates 'OUR FAILED EXPERIMENT': Legislator renews calls to abolish HOAs following deadly Port St. Lucie dispute Port St. Lucie police said 62-year-old Paul Maraio shot and killed his neighbors over a long-standing HOA dispute Kate Hussey, WPTV A Port St. Lucie HOA dispute that turned deadly is renewing scrutiny of HOAs as one lawmaker moves to abolish them. By: Kate Hussey Posted and last updated A deadly shooting in Port St. Lucie this week has renewed focus on violent crimes connected to homeowner associations across Florida, as lawmakers consider legislation that could allow communities to vote to abolish their HOAs.Port St. Lucie police say 62-year-old Paul Maraio barricaded himself in his neighbor's home after shooting and killing two neighbors over what investigators describe as a bitter HOA feud. WATCH: Is HOA-related crime on the rise in Florida? Legislator renews calls to abolish HOAs following deadly dispute The dramatic scene unfolded as officers stormed the residence, with authorities revealing the HOA was actively seeking to evict Maraio from the community.""Unfortunately it happens a lot more often than one would think,"" said Eric Perez, an HOA attorney with Perez Mayoral Law in Coral Gables. Perez, whose firm represents thousands of homeowners, says HOA violence isn't rare — it's routine. He's witnessed even minor disputes escalate into physical confrontations.""You know, temperatures are sometimes at an all-time high when there's an ongoing dispute, and people may unfortunately take to physical violence,"" Perez said.PREVIOUS COVERAGE: Florida lawmaker floats ban on homeowners associations amid growing backlash Florida lawmaker floats ban on homeowners associations amid growing backlash Attorney Jeff Kominsky says he's seeing more HOA disputes escalate into legal action, and recent data may explain why. A study from Onyx Capital Management shows HOAs nationwide now top 373,000, up 10% from 2024, with Florida making up nearly half of those associations.""When you have a built-in high number or quantities of associations, things can happen,"" Kominsky said.While FBI and DOJ data doesn't specifically flag HOA-related violence, Florida court records reveal case after case of escalating disputes.In December 2022, Martin County deputies say Hugh Hootman shot and killed his neighbors at Cedar Point Condos. A 911 call obtained by WPTV reveals it started as an HOA argument.""There's been an ongoing dispute,"" the caller reported. WATCH: Past cases of HOA-related disputes in Florida Past HOA-related disputes in Florida That same year, a Broward County HOA president was arrested, accused of pointing a gun at neighbors. In 2023, Miami Beach police arrested a former condo president accused of sending threatening texts to an HOA board member and trying to set a resident's truck on fire. This year, a judge sentenced a Seminole County man for intentionally setting his own condo on fire over HOA problems. ""I think these, some of these disputes are very under-counted. I think this is one of the more common issues surrounding Florida at the moment,"" said Republican Representative Juan Carlos Porras of Miami. Porras is now drafting legislation that could let communities vote to abolish their HOAs — not a statewide ban, but a path to eliminate HOAs that residents believe aren't working. Port St Lucie Police: Dispute between suspect, victim dates over a year before double homicide Samantha Roesler ""In my personal opinion, I think HOA is our failed experiment, and there needs to be some sort of guidelines in place on how to get rid of them,"" Porras said.However, both Kominsky and Perez express concerns about the feasibility of abolishing HOAs entirely.""I think every association is different structurally,"" Kominsky said.""I would say for the most part, there are some practical concerns as to how to adequately govern a community if there is no HOA,"" Perez said.Both attorneys emphasize that homeowners need to know their rights, noting that many escalations happen when people feel out of options. Porras expects an update on his legislation within the next week.""It doesn't have to end like this,"" Kominsky said.This story was reported on-air by a journalist and has been converted to this platform with the assistance of AI. Our editorial team verifies all reporting on all platforms for fairness and accuracy.","https://www.wptv.com/wptv-investigates/our-failed-experiment-legislator-renews-calls-to-abolish-hoas-following-deadly-port-st-lucie-dispute"
"'Definitely more alert now': Coyote sightings spark community meeting","NewsPalm Beach CountyRegion S Palm Beach CountyBoynton Beach Coyote sightings in Boynton Beach spark community meeting WPTV's Ange Toussaint speaks to residents and wildlife experts about the issue and what may be driving wildlife into residential areas Robert Duran By: Ange Toussaint Posted and last updated Increased sightings of coyotes in Boynton Beach have prompted city officials to call a community meeting to educate residents on how to stay safe.WATCH BELOW: 'Definitely more alert now,' Henrique Lopes tells WPTV Coyote sightings in Boynton Beach spark community meeting For weeks, neighbors said they’ve seen coyotes roaming through their communities.“Usually, when I walk my dog, Ginger, my pet. I’ve seen him coming out of the canal here,” Henrique Lopes said.Lopes lives in the same neighborhood where surveillance video captured a coyote attacking a woman walking her three dogs just a week ago. One of the dogs later died from its injuries.The attack has left neighbors on edge.“I’m definitely more alert now,"" Lopes said. ""I used to walk the dog with the long leash and now I keep the leash short, looking every way, making sure he’s not coming behind me, stalking me.”WATCH: Neighbors help dog that was dragged off by coyote Neighbors in Boynton Beach community rescue dog from coyote Scott Yonan said he isn’t worried about his own dogs, but understands the growing concern.“I don’t really worry about it with my dogs too much, but there are a lot of people with puppies, small dogs and even kids who have to be worried,” Yonan said.Boynton Beach police said they are aware of the increased sightings and are teaming up with the Florida Fish and Wildlife Conservation Commission for a public safety meeting next week.FWC said coyotes can be found in 67 counties across Florida.Wildlife Troopers staff biologist Noah Cohen said ongoing development across Palm Beach County may be driving wildlife into residential areas.“Obviously, as new communities are built, this takes away from their territory, that forces wildlife into more residential areas and this is what has led to an increase in sightings in a number of different animals,"" Cohen said, ""not just coyotes, but also greater problems with racoons as well.”He urges residents not to approach coyotes, to keep pets leashed, and to supervise small children.“Generally, it’s not going to attack you unless you give it a reason to,” Cohen said.The community meeting is scheduled for Tuesday from 7 p.m. to 8 p.m. Residents are encouraged to attend. If a coyote appears aggressive or dangerous, police say to call 911.Link to Zoom Meeting: https://myfwc.com/conservation/you-conserve/wildlife/coyotes/","https://www.wptv.com/news/region-s-palm-beach-county/boynton-beach/coyote-sightings-in-boynton-beach-spark-community-meeting"
